id,title,description,publishedAt,tags,categoryId,defaultLanguage,defaultAudioLanguage,thumbnail_default,thumbnail_high,duration,viewCount,likeCount,commentCount,privacyStatus,channel_id,channel_title,channel_description,channel_country,channel_thumbnail,channel_subscriberCount,channel_videoCount,transcript
Pg8Yi6x2Pwk,"Volvo EX90 - Rolls Royce Luxury, Model X Price!","The Volvo EX90 is a luxury sleeper hit!

Shot on iPhone 16 Pro Max
Rode Wireless Micro: https://geni.us/FBnQh",2025-03-31T17:53:31Z,,2,en,en,https://i.ytimg.com/vi/Pg8Yi6x2Pwk/default.jpg,https://i.ytimg.com/vi/Pg8Yi6x2Pwk/hqdefault.jpg,PT12M9S,2021962,45257,3043,public,UC2J-0g_nxlwcD9JBK1eTleQ,Auto Focus,Car videos from MKBHD!,,https://yt3.ggpht.com/hUes3DegxJOavHd_NNUcI4-1jAGDlqPjPqxJzfr27t5SZ3KnLtgbVF0VfK2FtVlldTtI-YEIWA=s88-c-k-c0x00ffffff-no-rj,1180000,117,"all right I think we might be sleeping
on this Volvo and I'll tell you why I've
reviewed a lot of really luxurious cars
on this channel and you know what they
say about like the Bentley's and the
rolls-royces of the world they're not
actually a good value but if you truly
want the maximum luxury the 101% luxury
then that's where you got to go to get
it and it's going to be like3
$400,000 but how do you get as close to
that as possible without spending that
kind of money what does that actually
look like and I have a new answer to
that question this is my actual new
answer this is a Volvo ex90 and I'm
telling you guys this thing is like
98% of the luxury of that car quarter of
the cost so I'll disclaimer this by
saying I've never actually driven a
Rolls-Royce cinin which is probably
closer to the size of this but I did
review and drive for a week the
Rolls-Royce Spectre which by all
accounts and by everyone else who I've
seen review that car that is like Peak
rollsroyce the quietest the smoothest
the most soft and plush that's that's a
PEX right this now that I've driven it
for a week is so close in so many areas
that were special about the Rolls-Royce
so I'm going to go through that and
explain why I think we're probably
sleeping on this car but first just the
basics this is a three row SUV from
Volvo and it starts in the 80s I think
it's 80 something thousand this one is
somewhere in the '90s it's got this sort
of beige sand color twin motor roughly
100 KW hour battery and this is a pretty
highly optioned one that'll get you
about 300 Mi of range on a full charge
now Volvo just kind of refreshed their
entire lineup here so this is brand new
I actually a long time ago for Top Gear
reviewed the xc40 recharge which was the
previous like generation of their
electric crossover now they're doing
ex30 and ex90 this is the big one and so
it kind of looks similar different
headlight design still big wheels still
generally the shape of a Volvo if I come
back here you'll immediately recognize
the shape like this this light pattern
that they do very much Volvo this tail
light up here now this one's also the
performance trim which is another option
to get it to be a little bit quicker in
a straight line which is fairly easy for
an EV but generally I think this is a
pretty good looking car as far as big
three row crossovers go pretty standard
sure I'll still give the edge in luxury
that last few per that's going to go to
the rolls rice again that is a slightly
better looking car if you're going to
spend crazy money obviously but this
isn't crazy money this is a regular L
priced expensive car but if you're the
driver here's where the luxury starts
right so if I'm going to get in this
front seat and start thinking about how
much money I spent check out how loud
that
is can't hear a thing I didn't edit that
at all so thing number one is it's
incredibly quiet in this car and you
know what's funny when the the Volvo
reps dropped this off they actually
mentioned to me hey uh this thing's
about as quiet as a rose a spectre
inside I'm just saying and then they
like walked away in my head I was like
yeah right I was in that car I was
sitting next to a garbage truck and
couldn't hear it and now that I'm in
this car and I've driven it and I've
I've played with I mean these windows
are plenty thick and have double glazed
glass and all that they've done an
incredible job probably a 99% job as
good so that's number one is it's super
super quiet in here which brings me very
quickly to number two
which is you look around in a Volvo and
you see this and you see this you see
the Bowers and Wilkins setup the
speakers in this car are absolutely
unreal s tier speakers in this car it
helps a lot that it's quiet in here also
but man this is a top five speaker
system I've ever heard in a car it's one
of those that you listen to your music
you listen to whatever you're listening
to you get to your destination you throw
it in park and you just sit here for
another 2 or 3 minutes just listening to
the rest of that song or the rest of
that album cuz it sounds that good you
start to hear things that you've never
heard on any other speaker system it's
really good but then the third major
thing about these Ultra Luxury
experiences is definitely just material
choices and sitting in this interior
okay yeah I'll still give the edge for
sure to Rolls-Royce in that category
that's where they really shine they have
these crazy next level like super plush
floor carpets and like the seats are
incredibly soft and comfortable and way
more metal and physical controls the my
back same thing okay totally get it this
is a more modern and clean take on a
luxury interior that I personally like a
lot I mean you have the big screen in
the center and the second screen behind
the steering wheel but then the rest of
it I think is laid out really nicely
there's a lot of room so you got storage
down there you can sort of hold
something up against this if you want to
USB type-c ports this is your key card
which you put right here to drive unless
you want to Wireless charge your phone
two cup holders a nice little glassy
volume slider and also a play pause
button and some more storage space in
there so this is nice then you also have
some leather over here obviously the
speakers I I think though if you want to
consider you can't forget this the seat
just sitting down when you sit down in
the car what's the most important thing
for materials it's how the actual seat
feels and these
seats are really good they're super
comfortable they're like again 99% of
the Rolls-Royce seat maybe not visually
but they're super soft they're heated
they're ventilated they've got this
extension rest for your thighs there if
you want that this up here is a speaker
uh they're just the right softness just
the right amount of support and
bolstering this is a great great seat
now it may be time for one more hot take
so I'll just give it to you I don't
think I've ever experienced a good
massage from a car seat lots of people
like to say oh yeah it's got massaging
seats cool I'm not going to use that but
if you want to this car also has them
it's got this little adjustment down
here you tap that button you go over to
massage and you can set up a super
intense high-speed seawave massage
pattern and it's a 20-minute pattern and
then it starts doing things it's fine I
almost never actually care about that
but you have it in this car the software
experience though better than a
Rolls-Royce I'm just going to say that
right off the bat Wireless carplay is
great I've got my phone connected but
also you can just use the Google
experience you can go Google Maps you
can do almost anything you'd normally
want to do here and it is smooth good
job with the software Volvo if you've
seen Volvo's cars and pul stars before
you know this is good I am still a
little bummed or at least a little uh I
think people will be bummed that most of
these things are on the screen instead
of real buttons like the HVAC controls
could have been like a nice luxurious
set of real buttons down here but
instead you got to go here and bump that
up or down and like it's a nice super
well heated set of seats and the
steering wheel is great but I would have
liked to set a buttons for that but okay
it's it's not quite the maximum luxury
so I guess that gets a pass but let's
get to the second row though because
there are more things that you need to
see in this three row SUV oh that rhymed
okay second row is very spacious I get
in here as a 63 person behind a 63
driving position and uh let's do another
sound test
demo it's so quiet uh but yeah plenty of
leg room here they kind of have these
cutouts behind the seat but I think all
three people in this second row can be
adults and be totally fine and this also
gives you a nice view of this enormous
sunroof above our heads very very nice
tinted sunroof um I'm you get the vents
you get the speakers you get the uh
controls down here this is a nice second
row experience the third row which I'm
not going to get in in this video but
I'll show it to you is similar to the
rivan r1s it's it's two seats back there
I wouldn't put adults back there for
very long there's not a lot of leg room
kids can be back there for sure there's
cup holders there's USBC ports there's
more speakers there's more vents so
they're not like getting crushed back
there but yeah there's a second row but
you can always fold that down and make
more trunk space if you want these are
just such good materials though I I
really think the comfort thing is
underrated it might not look exactly the
same it might not feel exactly the same
but for a fraction of the cost of that
car they're shockingly comparable very
similar so Volvo if I could offer any
feedback it's not perfect there are some
things that I've already mentioned I
would rather have seen physical controls
for H back um this is I'll say one of
the best implementations of carplay I've
ever seen where I can pull up ways here
and it will put the ways directions up
here and allow me to continue doing
other things on the screen so that's
good this though I don't know why they
keep doing this they have this single
switch oh sorry I got to put my foot on
the brake and start the car single set
of switches for the windows up front
which will put the front windows up or
down but if I want to change the back
windows I have to hit this button and
then I'm controlling the back windows
just put just put four sets of window
switches here it's not that expensive to
have extra switches I feel like that was
inspired by Tesla and they didn't have
to do that and then driving this car the
last thing that is really important to
the luxury experience and you've heard
people talk about the rolls Ro
suspension before is it's super floaty
the goal is to be completely
disassociated with the road I don't want
to feel a single pothole it's funny like
sports cars are like I run over a coin
and I can tell if it's heads or tails
but in a Rolls-Royce Spectre I run over
a a trash can and I barely notice it and
that's the whole point of of the luxury
of this car is you're just kind of
cruising along this suspension is very
very similar it's super good really good
adjustable air suspension it rides
smooth on tons of horrible roads I was
super impressed by that the one pedal
driving though I felt could be
calibrated a little bit better so there
is the option while you're driving to
turn on uh obviously all-wheel
performance is going to be great if you
turn that off it's just going to be
front-wheel drive and a little slower
but one pedal drive is either on off or
Auto I turned it on because I wanted to
do regen all the time when I take my
foot off the accelerator putting your
foot back down on the accelerator was a
little bit soft for the first part of
the the travel of the pedal I wish it
was more direct I wish that calibration
was better closer to what Tesla or
rivian does so that's a subtle complaint
but in general yeah if you're curious
the car also rides super well so I'll
leave you with this when you think about
getting a large luxury crossover like
this and you want it to have you know
all the basics all the fundamentals good
space good comfortable seats good range
and then you just want it to be as
luxurious as possible I think this one
actually
nailed all of those fundamentals as well
as they Poss could the sound isolation
the comfort of the seats the softness of
the suspension the incredible speakers
like those four pillars are awesome in
this car I also feel like uh I haven't
even mentioned this but this little lar
Suite up top here it's not activated yet
uh so the self-driving and cruise
control features don't use it yet and I
wonder if they'll get better when that's
activated but in general I'm not too
worried about it I think this car is
great so shout out to Volvo the ex90
surprised me and how good it is and
maybe now that this video is out we
won't be sleeping on them so much thanks
for watching catch you in the next one
peace"
Az6nemkRB1Y,Reviewing my First Car: Toyota Camry Hybrid!,"My first car has come a lonnnggg way.

Shot on iPhone 16 Pro Max
Rode Wireless Micro: https://geni.us/FBnQh",2025-03-19T14:34:36Z,,2,en,en,https://i.ytimg.com/vi/Az6nemkRB1Y/default.jpg,https://i.ytimg.com/vi/Az6nemkRB1Y/hqdefault.jpg,PT11M20S,1209114,31821,1950,public,UC2J-0g_nxlwcD9JBK1eTleQ,Auto Focus,Car videos from MKBHD!,,https://yt3.ggpht.com/hUes3DegxJOavHd_NNUcI4-1jAGDlqPjPqxJzfr27t5SZ3KnLtgbVF0VfK2FtVlldTtI-YEIWA=s88-c-k-c0x00ffffff-no-rj,1180000,117,"So, my first car ever was uh junior year
of college. Um I remember this cuz all
the upper classmen had cars. All the
younger kids didn't. And the way it
worked was I played ultimate frisbee.
And if you're on the team, every time we
go to a tournament, we'd all pack up in
one of the upper classman's cars and go
for a road trip. And when all the
seniors graduated, we lost all their
cars. And so, we needed some people to
get new cars. So, when I got up to being
a junior, I needed to get a car that was
decently comfortable, could fit a bunch
of people, and had decent enough gas
mileage. And so, I ended up with this, a
used red Toyota Camry XLE. This is a
2014. These are the actual pictures I
took of that thing the day I bought it.
So, now to this day, whenever I see a
red Camry from around this year, I think
of mine. And I averaged 37 12 mp gallon
lifetime with that thing. It was sick.
And I remember that because I played the
little efficiency graphic in the screen
in the front of the car like a video
game. Like I wanted to max my high
score. Like if I got downhill enough for
a long enough drive, I could get into
the 40s. 40 m per gallon. It was crazy
back then. That was my idea of fun as a
college student. Anyway, this this is
the newest Toyota Camry. And so I
figured I'd sort of take a look back at
my first ever daily driver and how far
it's come in the last decade because
Toyota, as you know, has been sort of,
some might say, stubbornly focusing on
hybrids instead of doing electric cars.
And I mean, you might have seen my
previous video. It's kind of what they
do. They are getting really, really good
at hybrids. And so, let's take a look at
how far this Camry has come in the last
decade, cuz it's basically a whole new
car. Now, when you see a Camry on the
road, the proportions of the thing have
not changed that much. Like, the general
shape and size is very much still Camry.
I'll talk about some of the extra trim
bits on this one in a second. But
inside, you're looking at a 2 1/2 L
naturally aspirated inline 4 cylinder.
And uh there's actually three electric
motors. There's two at the front and one
at the rear. So, it can actually drive
all-wheel drive on electric power only.
And when you combine that gas and
electric, it's 232 combined horsepower.
That's not actually that little. That's
surprisingly peppy. I'll talk about
that, too. It's a 1 kWh battery and it's
rated for 44 m per gallon highway. So,
on a full tank, that's something like
550 mi. The Camry's main goal is
definitely still to be the economical
option and starting at $28,000, it very
much is still firmly planted there. But
what's funny is you can definitely still
option up a Camry maybe higher than you
expect. If you were to guess how high
you can spec a brand new Camry, you
might be a little low. Similar to
specking an iPhone 16e up to the max
storage and paying $900 for it. I don't
recommend this, but you can spend
$50,000 on a brand new Camry. I think
this XSSE trim starts at like 35 grand
or something like that. So, don't do
that. But at the base price, starting
lower, economical option still. Now, I'm
going to be totally honest. I think the
new Camry looks really good. Similar to
how this bird up here looks way better
than your average Seagull. This car
looks way better than your average older
Camry. It's got this nice grill up front
here. Kind of blocks out some of the
sides, but then has a little second
arrow feature. I like that. That's a
reflector. There's your headlights.
Similar to the Prius's look. I think
it's nice. You come along to the side
here. It's obviously the gray color and
you kind of see the red seats. So,
that's kind of cheating, but nice wheel
design. You flow down the sides, you've
got some nice shapes and then the black
roof color. So, this trim bit here kind
of gives the car a bit of a sleeker
lower look if you ask me. And then XSSE
trim. Okay, you've got this little baby
spoiler thing. They don't want to
actually put a real spoiler on it
because you still need this car to slip
through the air and be very efficient.
But, you know, black contrast that kind
of looks nice. And then look down here.
Look, dual tail pipes. Not bad. Lots of
nice lines on this car. Dare I say even
sporty a little bit. Look, look at that
diffuser down at the bottom. And this
black trim. It's not the point,
obviously. But here, let's get into the
practicality features cuz if you hold
down that trunk, it will automatically
open up all the way. And yes, it's a
Camry. So, it's got a nice fullsize
trunk
and nice spare. So, you're never going
to be out in the cold without that.
Obviously, the trunk is important for a
Camry. And this would absolutely still
qualify if I was trying to get a car
like this today because look at this
interior. This is going to remind you a
little bit of the Prius, but a lot of
Toyota cars all look pretty similar in
this way. Now, this is a bright red
leather interior, and I kind of I I like
it a lot. It looks sick. The car that I
had had a tan cloth interior, which was
also totally fine. A little harder to
clean, but it lasted. to do the job. But
you can option up a Camry with this like
nice red leather and this these accent
pieces and the speakers integrated and
more speakers down here. And even though
there's a lot of plastic, it does
actually feel a bit more premium if
you're into that. But then, yeah, all
the other things that you know and love
about a Camry, well, they're all still
here. It kind of feels like I've
optioned up a mid-range phone to cost
$1,000 where I've gotten a whole bunch
of extra features brought down from the
world of premium devices, but I also
kind of still have the bones of the
economy option. So, you do have a
wireless charger here. It fits like the
biggest phones, so that's great. You got
some storage there, two cup holders,
plenty of storage in the middle. Love to
see that. And you've got all the drive
modes right here. This is basically all
you really play with when it comes to
driving the Camry. obviously your gear
selector, but EV only mode if you want
that. Brake hold you can turn on and
then switch between eco, normal, and
sport. Now, if you're a gamer like me
and you're trying to get the max uh
efficiency score, there you go. Eco
score. You basically can read this as
you're driving, your startup, your
cruise, and your stopping are all
factors that affect how good your
mileage will be. So, as you start up,
you start up and you accelerate really
smoothly and nicely. That'll be good.
you'll mostly use the electric power and
if you go above a certain power
threshold then the the gas motor kicks
in. You can play with that and you can
get to really really good skill levels
at getting the maximum mileage. Similar
to the Prius, again I think Toyota's
software here is really good. Uh you can
obviously pair your phone, but then you
have all these physical controls here
which do a good job. So your seat
cooling or heating but not at the same
time. Temperature up and down fairly
intuitive. Fan speed up and down. You
hear the uh gas motor kick in when I do
that. And then you have your power down
here. So, two USBC ports and one USBA
port. Look, you got even like these
metal pedals and you have this big
sunroof. Like, there are there are a lot
of premium features. Heated steering
wheel. Premium features in this car
despite it still being the economy car
option. Here's one of my favorite newer
features my old car didn't have. A lot
of EVs nowadays, when you let off the
accelerator and you start to regen or
slow down, the brake lights turn on.
Even though you're not putting your foot
on the brake, you've let off the
accelerator and started to slow down.
So, the brake lights will turn on and
light up to know the car behind you can
see that. Similarly, they all have
screens that show the car in them. So, a
lot of them will light up the brake
lights on the little car on the screen
in front of you. This one doesn't have a
little screen showing the car. But if I
go ahead and hit that brake pedal here,
boom. You see these little red lights
here? That's how you'll know your brake
lights are on. So, anytime you slow down
with enough regen or hit the brake
pedal, you'll see the red lights turn on
and you'll know that your brake lights
are on. So, in case you were wondering
if the brake lights were actually on,
you'll always be able to tell. Now, one
more thing that's way better about this
new Camry than the old one, uh, the
cameras are way better, which shouldn't
be a surprise for 2025, but they are.
Now, if I hit that camera view button,
it starts doing this like weird 360
animation thing. I'm not sure why it
plays that every time, but if I just put
the car in reverse, hits up that rear
camera and an overhead top down 360
view. You can see everything here. You
can correct for distortion or show the
ultrawide version. You can show
different lane markings or turn them off
completely. This is great. I'm I am
definitely guilty of being one of those
people that can only park um with
cameras. So, I was very happy to have
the cameras back then and they're even
better now. Okay, let's check out the
back seat because if you are going to be
transporting people, you want to at
least have a decent enough legroom.
Maybe if you're transporting ultimate
frisbee athletes or college kids that
are somewhat tall, you'd care about
this. So, for the back here for a road
trip, honestly, very acceptable. I've
been in the backseat of my own car many
times, and this feels very similar. The
fact that everything is bright red, I'm
also definitely liking that. Um, but you
also have this this glass up here, which
this uh I believe, yeah, you can motor
this open or closed, which is nice. Some
nice storage here, your vents here, no
screens needed, and some power with
USBA or USBC. The shape of the Camry
means the the sloping roof line kind of
cuts in a little bit. And they have
these cutouts over each seat to give you
a little bit more headroom, but if
you're tall like me, you could find, or
at least if you have a lot of hair like
me, you could find that you are up
against the ceiling. Honestly, not a
horrible amount of headroom, but
something to keep in mind. I think I
would have still been very tempted by
this car if this exact type of spec
existed back in 2014. Now, driving the
car itself, obviously, you're not buying
this as a performance car. It's not a
sports car, but I will note that a
highlight of it is one, it rides very
well. It's very comfortable. The
suspension is tuned to just be a
cruiser, and it's a lot peppier than I
remember, which must mean it is is
quicker. 232 horsepower is not going to
blow anyone's mind, but because of the
electric drivetrain and the hybrid
system, Toyota's got this tuned where if
you move that pedal down a little bit,
you can sort of zip up and into spots
and out of spots very, very easily. It's
got some pep to its step, which is
exciting. I did not expect that of this
car, but it pulls that off really well.
So, it's comfortable, suspension rides
well, and it's got some pep. So, look, I
I get why Toyota continues to do the
hybrid thing because number one, they've
gotten really really good at it. Number
two, they've also kind of committed to
it. Like, they do make that one EV that
I reviewed that's not very good. Um, but
they've kind of got this whole range of
cars now at a bunch of different price
points where they can offer you
something that's going to make sense and
economical and get you a ton of miles
per gallon, and that's what everybody
wants. So, I'm a fan of this new Camry.
I I love that there's new sensors
everywhere and there's new, you know,
adaptive driving features and a lane
keep assist and stuff like that. As
someone who went on a ton of road trips,
I would have loved to have had that in
my car back then, but it's 2025, so now
someone else in my position will love
that, too. And uh I think it looks
pretty good. Maybe I'm biased because
I've liked Camry in the past, but well
done Toyota. Keep making good cars like
this. All right, thanks for watching.
Catch you in the next one. Peace."
