id,title,description,publishedAt,tags,categoryId,defaultLanguage,defaultAudioLanguage,thumbnail_default,thumbnail_high,duration,viewCount,likeCount,commentCount,privacyStatus,channel_id,channel_title,channel_description,channel_country,channel_thumbnail,channel_subscriberCount,channel_videoCount,transcript
GzS-xgs5y64,GMC Sierra EV vs Silverado EV - A Justifiable Premium?,"Shot on iPhone 16 Pro Max
Rode Wireless Micro: https://geni.us/FBnQh",2024-11-29T15:30:06Z,,2,en,en,https://i.ytimg.com/vi/GzS-xgs5y64/default.jpg,https://i.ytimg.com/vi/GzS-xgs5y64/hqdefault.jpg,PT1M29S,167955,6246,196,public,UC2J-0g_nxlwcD9JBK1eTleQ,Auto Focus,Car videos from MKBHD!,,https://yt3.ggpht.com/hUes3DegxJOavHd_NNUcI4-1jAGDlqPjPqxJzfr27t5SZ3KnLtgbVF0VfK2FtVlldTtI-YEIWA=s88-c-k-c0x00ffffff-no-rj,1180000,117,"so there's not that many fully electric
pickup trucks out there right there's a
cyber truck there's the rivan there's a
Silverado EV the Hummer EV but now
there's a new one new kit on the Block
and I I said new but also kind of not
that new because this is basically the
same as a Silverado EV now to a lot of
people that's a good thing cuz that
means it still has that huge front trunk
it still has that huge 205 KW hour
battery which means it still has that
enormous 470 plus mile range still
charges at 350 Kow it still has the huge
6ft bed it still has the midgate in
between the front and the back so it's
fully featured it still has that 754
horsepower all-wheel drive dual motor
action and that paddle shifting
increased regen all of that still here
so okay what's different why is this new
slightly different design different logo
on the front that counts also a
different logo here but I'm going to say
it's because the interior is just
slightly better I think you could argue
it's a little bit more premium I think
the speakers are a tiny bit better and
it's the you can see Edition one over
here but same software just just a
slightly more premium looking and
feeling interior in this one and then
this one also happens to be able to crab
walk that feature from the Hummer EV
where it can turn all four wheels the
same direction and kind of Glide
sideways diagonally kind of it's
debatable how useful that actually is
but yeah this one will cost $3,000 more
than the Silverado EV so would you pick
it over the Silverado or the other EV
pickup trucks let me know"
E0EY4dxMAxA,The Polestar 3 is Amazing,"The Polestar 3 is shockingly good in areas you wouldn't expect it to be.

Shot on iPhone 16 Pro Max
Rode Wireless Micro: https://geni.us/FBnQh",2024-11-25T15:00:13Z,,2,en,en,https://i.ytimg.com/vi/E0EY4dxMAxA/default.jpg,https://i.ytimg.com/vi/E0EY4dxMAxA/hqdefault.jpg,PT15M50S,1154464,29309,2872,public,UC2J-0g_nxlwcD9JBK1eTleQ,Auto Focus,Car videos from MKBHD!,,https://yt3.ggpht.com/hUes3DegxJOavHd_NNUcI4-1jAGDlqPjPqxJzfr27t5SZ3KnLtgbVF0VfK2FtVlldTtI-YEIWA=s88-c-k-c0x00ffffff-no-rj,1180000,117,"so look I um I love New Jersey I love
New York I love being right next to the
Northeast and all the construction and
everything it's great it's just the
thing is shooting car videos in the
winter is just one of my least favorite
things it's one of the hardest things to
do but we're going to do it anyway for
this thing right here this is the pole
star 3 and I was waiting to check this
out I'd seen a lot of these new po star
coming out and I've checked them out in
the past and I've really liked them and
this one similar to the last video like
I said is in that category that's really
crowded the midsize crossover why would
anybody buy your midsize crossover but
now that I've tested this one yo I
really like this one but there are a few
weird things about it it's actually
amazing how far the highest highs and
the lowest lows are from each other in
this thing I'm also glad that this is an
electric car so it'll be nice and warm
and cozy when I get inside it's waiting
for me but we got to show you the
outside first so this is the post start
three This SUV is going to start at
around
$67,000 but that would be for the single
motor lowest than one and you can spec
them right up all the way into the
80,000 uh and this is the performance
spec this is dual motor all-wheel drive
really top tier trim and I think it
looks phenomenal actually they do a lot
of this print stuff with pstar so you
can see the specs right on the side
there you go1 KW battery but design-wise
I love it first of all this is a sloping
low roof line line much lower than I
mean the Acura we just saw and a lot of
other cars in this segment have higher
roof lines so you would think that
headro would be a concern but we'll get
inside in a second you'll see it's not
which is great you've got these big
diamond cut Wheels yellow brake calipers
and then the front design I think is
really nice if I was designing an EV
that had to be aerodynamic but still has
angular elements this has got it so you
see these sort of lines and dots and the
text thing that they do but also this
here is a wing fully functional front
wing on the Pulstar 3 this is creating
downforce and that sort of Smooths the
air over the top of the car again with
this low roof line to this rear wing and
this is also fully functional Arrow
there's not a lot that I don't like
about what they did with this car I
think some people might not like this
one little uh kind of cheesy looking
piece at the back but that is still
functional for aerodynamics you've got
this tail light bar back here that I
also think looks good again pretty low
roof line but in general I like the look
of this this car's design is nice it's
got a lot of bars a lot of thin lines
your blinkers your
headlights good stuff even a good color
I think honestly the it's cold
the hey guys oh God hi the the best
compliment that I can give a car I think
is that this is how I would have
designed it like this if I was designing
a car this is what I would have done and
I love that about a lot of pieces of
this car and and but jeez we should just
get inside because number one that's a
little much for me but also number two
it's freezing um also point out right
here really thin bezels on the mirrors
it's a subtle thing and then this is the
uh key card which you actually fun fact
you would normally think to tap it right
here this is the sensitive spot for the
key card to lock and unlock the pulse
star 3 if you tap it here nothing
happens got to top it over here so the
door handles come out from being flush
you pop it open there
and you get inside and now we are warm
and cozy in the driver's seat and that's
that's where the key go so this interior
again strikes a lot of balance between
the world of like Tesla this super super
minimal you know screens and nothing
else being features inside the car and
actually having nice materials it's
still leans a little bit too far towards
the minimalism and I'll show you why in
a second but I mean look at these look
at this angle right here just just this
right you've got a nice black headrest
with that nice text right there super
thin font heated and cooled seats and
the nice bright yellow seat belts I
think that that is sick that is a great
look these are very comfortable seats
you can see them they have adjustments
so this uh sort of thigh support comes
out as well the whole theme of the
entire car is sort of black and yellow
and it's consistent so the HUD is up
there but you also have a screen behind
the steering wheel and then you have
this single screen in the center but you
do still have manual aack controls and
they're kind of nice looking you've got
this drywood and a bunch of different
materials around the cabin uh this sort
of opens up here and you can see this
one Central piece of storage this is
more open than it was in the Volvo but I
still don't think like I'm never using
this storage what is this
for a water what is it who puts things
back here I don't know it's kind of
hidden uh but two USBC ports back there
and then you've got the center which is
your volume knob and play pause which is
a nice little you know single physical
element there this is again one wireless
charger not two but you put your phone
sideways here or you put your key card
there and then you got your two cup
holders so this is the inside of the
pstar 3 and then okay this is again just
a little bit too just a tiny bit too
digital right so these are all sort of
unlabeled soft buttons on the steering
wheel but you press them and they sort
of activate things inside the car and
when you're
driving you put your hand on that part
of the steering wheel and it tells you
what it's going to do when you press it
so I press my finger on the bottom one
right there it says oh that's going to
be able to change your menus and Views
if you press your finger on the top one
that's your voice assistant which is
it's the g-word voice assistant so it
kind of tries to tell you what it's
going to do before you actually press it
because they're unlabeled buttons um I
don't like this though they decided to
only do one set of window controls and
then you hit that button to do the back
windows so only one set and then a
capacitive button that's like a
money-saving measure thing that I don't
love about it so it's crazy my my take
is that this interior this car in
general is amazing and it's amazing
because how could one car have so many
awesome Design Elements this this thin
bar right here this awesome black and
white contrast and the stitching and all
this stuff how could it have all that
awesome stuff and then also have like
gloss black here and cheap out on a
window and like do all these things like
this glove box only opens with a button
on the touch screen there isn't even a
there's no handle there's no way to open
it other than a button on the touch
screen that's amazing that one car could
have so many great design choices and
also have such poor design choices
here's some other little things right
these are the stocks behind the steering
wheel little bit of gloss that's okay
but listen to the the ping when you hit
park that's nice that's a nice feeling
that's just a tiny little thing but the
click there when you hit Park also over
here those are your front and rear
windshield wipers and you can see if I
hit that rear windshield wiper that it's
a nice thin bezel mirror as well got the
sunroof over our heads you can pick that
as an electrochromic option as well if
you want to um and then I got to say
something these
speakers these speakers okay this is a
Bowers and Wilkins system you can see
the Tweeter up front that's your first
clue this is a nice system right you've
got big speakers up here bigger speakers
down here got woofers behind you even
this this headrest it says Bowers and
Wilkins on it which is a good clue but
this is also a speaker behind your head
this is I'm tempted to say it's either
the second best or the best speaker
system I have ever heard in a car
period period the one I'm thinking of
that's maybe neck and neck with it is
the one from the mybach that I talked
about in that video and the mybot costs
way more than this obviously this is an
amazing speaker system it has Dolby
Atmos support it has a whole bunch of EQ
settings that you can change about it
but even straight out the box Bluetooth
connected to my phone I'll finish a drop
and I'll hit Park and I will sit in this
car and finish listening to the song
before going inside that's how good the
speakers are and of course it's a quiet
car as well there's great acoustic
isolation from the outside but amazing
speakers okay backseat experience does
matter too and this is the part where
you think okay maybe this sloping roof
line is going to be compromising a
little bit be totally valid to think
that but I got inside and I'll move
these uh nice little cushion back
pillows out the way is also pretty nice
so the floor is a little bit high so you
can see there's like a gap I've got my
knees kind of higher off the ground than
usual but leg room is plenty and head
room is plenty it's kind of amazing that
they fit 100 plus Kow hour battery
underneath me and they've got the seats
low enough that there is no problem with
Headroom at all um and then you still
have this nice aesthetic this black and
white so the thin LED lines there's LED
lights all throughout the car you
obviously have your window stuff your
huge speakers back here you have your
HVAC controls and your heated rear seats
and if you want that back pillow you got
it but again the neck pillow the black
and white aesthetic the orange seat bels
I'm I'm such a fan of just the general
design of this car here is one weird
flaw though and it could be consider it
could be worse it could be worse right
but the armrest is in the middle here
and you do get hidden cup holders there
which is nice uh but the path through to
the trunk which some cars don't have but
this one does is Tiny when you open that
up that's the pass through so you could
fit what some golf clubs through there
maybe um kind of an odd tiny little
thing but yeah in general they they
didn't really miss too much in the back
seat here you go hold that
down and that works so golf clubs two
sets of golf clubs all the groceries you
want and sub trunk nice so this is an
advantage over like something like the
ZDX we just saw which is this is a
groundup EV that has a little bit more
spacing or typical electric car so
really happy to see that you also can of
course use that privacy Shield so it's
got all the general practicalities of a
crossover it's got all the Aesthetics
you could possibly want how does it
drive that's the last question I'm going
to get back inside so I don't freeze my
face off while I talk about
driving but this is the performance
oriented one and it does Drive really
nicely so first of all the pstar 3 is on
air suspension in the higher end trims
it is not in the single motor trim but
this is on the air suspension and it it
totally makes up for the huge wheels and
rides really well and with the dual
motors it is a pretty decent performer
as far as acceleration it'll do 0 to 60
in about 4 and 1 half seconds but again
I wouldn't let that number fool you into
thinking it's not quick it's very quick
but we also kind of have to pair this
performance talk with all of this here
this uh this UI this is I mean this is
the only input device in the car this
just a center screen right here other
than these unlabeled buttons so anything
you want to change about the car
settings while you're driving you have
to go through this instead of physical
buttons in order to change their
performance modes in the car and you can
see the performance thing right here and
this always has a the performance button
right here but then I have go to
settings and then drive to access all
the rest of the performance stuff so you
can turn on sport traction you can turn
on creep or turn off creep but if I want
to change the suspension to standard
which is a nice little softer suspension
versus firm that's three clicks away
instead of just a single like mode
switch um the performance button that's
always down here at the bottom all the
time that is going back and forth Just
Between the drive
performance uh where' It Go Power
delivery setting so performance is the
fastest that is all-wheel drive all the
time full power full traction always
available the range setting which you
can switch it to at any time um
essentially decouples the front and rear
Motors and it makes it only a
front-wheel drive car for the most part
so if you don't need a whole bunch of
power it should be totally fine you
drive around town you're cruising on the
highway front-wheel drive all the time
maximum efficiency that is the lower
power motor and so that should give you
the most
range unfortunately this car does not
have that much range again it's kind of
amazing that it can do all of that it
can decouple the front and rear Motors
and even if you stab the accelerator it
takes about 7 Seconds to re-engage the
rear motor and give you all the power
back but even with all that Tech the the
range in this car is not that great this
dual motor version will give you about
270 miles of range on 100%
charge ah wish it was more um but that's
that's fine in performance mode awesome
straight line acceleration awesome
handling um if you hearken back to the
the postar 2 BST I reviewed it's kind of
awesome what they're able to do with
these cars um but then yeah you you have
to deal with all of this all of this
touchscreen stuff which I think looks
really nice but is not the most
functional again the glove box is the
touchscreen button I think that says a
lot about what they're doing with the
software this car um you can log into
Spotify you can do all the Dual be Atmos
stuff you can sort of rearrange these
most frequently used apps at the bottom
uh but yeah this is this is one of the
things you'll have to get used to if you
use this car which is some things are
several clicks away if I want to turn on
seat heating it's one two two clicks
away instead of one instead of just
having a button somewhere it's two
clicks if I want to adjust the fan speed
there is no fan adjustment I have to go
in here and then change fan speed here
or change where the air is blowing
manually here and do this while you're
driving I don't want to do that while
I'm driving so yeah the Google stuff
works great and if you navigate
somewhere that's out of the range of the
car it'll stop at a charger until you
have long to charge it'll do all that
great stuff so yeah it it's kind of a
mixed bag it it is it is really
beautifully designed but not the most
functional thing in the world and that's
basically the story of the pstar 3
I'm at the end of the
day it's kind of like I have a crush on
this car but I know it's not for me like
I I haven't seen that many EVS with a
front Wing like that right there or the
sloping roof line or the rear wing I
think that's awesome the design elements
of this car are all great I just I if I
designed a car it would look a lot like
this but then it has this weak range it
has this kind of a fitsy UI that's not
super not super intu it's missing some
physical buttons and I the speakers are
incredible but I just don't want to
drive this car for road trips so yeah
it's a tough one I like a lot of things
about it it's amazing but that that Gap
is is crazy keep working on it though
postar please please don't stop working
on these all right thanks for watching
catch on the next one peace"
