video_id,transcript
VyF8SOSP2YM,"In 1973, 200 indigenous protesters
staged an armed takeover of Wounded
Knee, where the US military had
massacred 300 Lakota less than a hundred
years earlier. They held the site for 71
days, exchanging gunfire with federal
authorities, who later admitting to
firing over half a million rounds at
tribal members, killing two native men.
And while most remembered the occupation
for its violence, the protesters also
held ceremonial dances, songs, and
prayers and gained a lot of attention
for their cause. But what were they
fighting for? Hi, I'm Jay Jim and
welcome to Crash Course Native American
History.
[Music]
The occupation of Wounded Knee was
broadly about treaties, formal
agreements, usually between two or more
states or nations. Many of the
protesters were members of the American
Indian Movement, which among other
things fought for the US government to
honor its treaty obligations with native
nations. See, between the mid 18th and
mid-1 19th centuries, a period called
the treaty era, the US entered into
nearly 400 treaties with Indian nations.
And it wasn't a fun Taylor Swift kind of
era. Most tribes were coerced into
signing these treaties. And the few that
entered willingly often did so without
full understanding of their meaning.
Treaties change tribal borders in major
ways during this period. and played a
huge part in removing Native Americans
from their lands as colonists pushed
westward. And when treaties didn't work
in their favor, the US government often
just disregarded them. And trust me,
they ignored a lot. During this period,
we also saw the formation and scaling up
of reservations. These were specific
portions of lands that the US government
allocated to tribes, often forcing them
to move there. We call the period
between 1850 and 1887 the reservation
area. But to understand how we ever got
here to this point and to the occupation
a hundred years later, we have to look
backwards. So, I'm going to walk you
through that hundredish year timeline,
which means I'm about to cover a lot of
history in a short amount of time. Think
of this as a primer, a little appetizer.
Don't make me say it crash course. So,
when you finish this video, you might
want to dig deeper. Actually, you should
want to dig a little deeper.
you will dig deeper.
>> Let's start back in the olden times,
1626, when the indigenous Lape people of
what's now New York, sold the island of
Manhattan, then called Manahhata, to the
Dutch for $24 worth of beads and other
trinkets. Or at least that's probably
the story you heard. It's been retold in
textbooks and paintings, and it's even
been cited as one of the foundational
myths of New York City. I hear it's
engraved on the Statue of Liberty right
under I'm walking here. But this story
has likely been exaggerated. Our records
of the deal come from the writings of
one lone Dutch dude who wasn't even
there when it happened. The fact is it's
possible that a band of Lape did sell
the island to the Dutch for about
$1,000. But the terms of the agreement
were influenced by each party having
very different worldviews. The Dutch,
like most Europeans, thought of land
ownership as something tangible and
permanent. But many native nations,
including some clans among the Lape, had
a very different viewpoint. In their
culture, land was controlled by the
community and divided for use among
extended family, which was different
from the individual system of ownership
Europeans were used to. Anyway, the Lape
likely believed that they were renting
or leasing the land, not selling it
outright. Joanna Gorlick from the Museum
of the American Indian put it this way.
I don't think the exchange itself is in
question. I think the meaning of that
exchange is in question. This is just
one early example, but these cultural
misunderstandings and some intentionally
fine print would play a large role in
the treaty era. As more and more
colonists came to the so-called new
world, they pushed Native Americans
westward, often violently, and tribes
would understandably retaliate against
the colonists who used their land and
stole their resources. But during and
after the American Revolution,
especially when the Young Republic was
weakened by its war with Britain, the
threat of conflict with Native Americans
was threatening. So many treaties at
this time were focused on peace and
friendship in exchange for land. In
fact, the very first treaty called the
Treaty with the Delawares was signed
during the revolution in 1778 between
the newly formed United States and the
Lape who the Americans called the
Delaware. It promised sovereignty and
statehood in exchange for, among other
things, letting American troops pass
through their land unscathed during
battles with the Brits. But although the
Lape held up their end of the bargain,
the US failed to deliver on theirs. This
pattern would unfortunately repeat
itself many times over. In the words of
Lakota leader Redcloud, they made us
many promises, more than I can remember,
but they never kept but one. They
promised to take our land, and they took
it. As the US continued to grow, these
treaties became less about keeping the
peace and more explicitly about gaining
territory. Some tribes signed away their
lands either willingly or unwillingly,
but many resisted, including the
Cherokee, Creek, Chalkaw, Chickasaw, and
Seol nations in the southeast. In this
region, colonists saw the tribes as a
roadblock to fertile land for growing
cotton.
In 1814, future President Andrew
Jackson, then a major general in the
army, led a push against the Creek
Nation. It came to a head in the Battle
of Horseshoe Ben near what's now the
Georgia Alabama border. Many of the
Creek were massacred, and the remaining
were forced to sign a treaty that seated
over 20 million acres to the US, which
was a wake-up call for many tribes.
Realizing it would be nearly impossible
to defeat the Americans in battle, many
chose to sign treaties that gave up much
of their land in the hopes that they
would at least get to keep some of it.
But in 1830, a year after Jackson was
elected president, Congress passed the
Indian Removal Act, which gave the US
government sweeping power to grant land
west of the Mississippi River to any
native nation that agreed to give up
their land in the east. These treaties
were officially considered voluntary,
but in practice that was far from the
truth as bribery and threats were
commonplace. Consider the treaty of
Newota, which Jackson signed with the
backing of a single Cherokee chief who
represented barely a fraction of the
tribe. It gave the US 7 million acres of
land in exchange for just $5 million.
Unsurprisingly, many Cherokee didn't
want to leave their ancestral homeland.
So, under the leadership of principal
Chief John Ross, they held out against
removal. Ross and his supporters argued
the treaty was a fraud and worked to
convince the government to recognize the
older treaties it had signed,
guaranteeing the Cherokee the land they
were already on. Ultimately though, the
resistance broke down in 1838 when the
remaining Cherokee were finally removed
at gunpoint by the army and members of
the Georgia militia. From there, Ross
led his people westward as part of what
would become known as the Trail of
Tears.
All told, during the 1830s, an estimated
100,000 Native American people were
forced to leave their homes and journey
thousands of miles west, and around
15,000 individuals died along the way.
But it didn't end there. As the US
continued to expand westward, the
government began re-encountering the
same peoples they had driven from the
east a few decades earlier, not to
mention those western tribes who had
already lived there. I mean, what did
they expect? But this time, the
government took a different approach.
What if instead of signing a bunch of
treaties, they just reserved a small
piece of land for tribes to live on? It
had been done before with some success
in 1786 when the United States
established its first reservation. So,
in 1851, Congress passed the
Appropriation Bill for Indian Affairs,
which allocated funds to build a more
robust reservation system, kicking off
the reservation era. Over the next 30
something years, most Native Americans
were either forcibly relocated or saw
their land dramatically reduced. And in
1871, Congress officially took away the
right of native nations to enter into
treaties with the United States
government. It was an unceremonious
amendment attached to an appropriations
act passed without the input of any
tribal members, and it was officially
the end of the treaty era. But what did
this mean for the nearly 400 treaties
that had been made in the last century?
Technically, they remained intact, but
this decision made it even harder for
them to be enforced, which brings us
back to Wounded Knee. See, in 1868, the
Lakota Sue signed a treaty with the US
that established a great Sue reservation
on 60 million acres of land. But not
long after, the US government discovered
a lot of natural resources on that land
and decided to do some classic takes
back seis. By the end of the reservation
era, only about 20% of the original
reservation remained with the rest back
in the hands of the federal government.
On top of that, reservation life was
difficult for the Lakota. Drought
combined with a lotments that were bad
for sustainable crop growth made farming
difficult. And both a near extinction of
the buffalo population and rules against
hunting on reservation land made their
traditional way of life nearly
impossible to sustain. So they had no
choice but to rely on government
rations. They were also disconnected
from their culture and identity, forced
to wear western clothing and abandoned
their traditional spiritual practices in
favor of Christianity. We're talk more
about life on reservations in a future
episode. By 1890, after a series of
conflicts in the murder of Lakota Chief
Sittingbull, tensions between the tribe
and the government had reached a
breaking point. US forces surrounded a
mini Konju Lakota camp near Wounded Knee
Creek where after a gun went off
accidentally, the military massacred
upwards of 300 Lakota men, women, and
children.
83 years later, the occupation of
Wounded Knee brought this massacre back
into the public eye. Many scholars point
to the occupation as the spark that
kicked off a massive push for
recognition of native treaty rights all
across the country. After all, those
hundreds of treaties are still the law
of their land, whether or not they're
honored. So, invoking them had become a
major strategy for native nations to
push for the return of their lands. And
since the occupation, a number of them
have used historic treaties to fight for
and achieve legal wins. I know all this
can feel like the distant past, but it's
not. Babies born on the day of the
Wounded Knee Massacre would have been in
their early 80s during the occupation.
And occupiers from 1973 joined protests
at Stand Iraq to object to Dakota Access
Pipeline in 2016.
The point is the fight for treaty
recognition continues right here, right
now. Native leaders and activists
continue to push the federal government
to honor its promises and momentum only
continues to build as new generations
join the fight.
Next time we'll talk about Native
American assimilation and the aotment
era and I will see you then. Thanks for
watching this episode of Crash Course
Native American History which was filmed
at our studio in Indianapolis, Indiana,
and was made with the help of all these
nice people. If you want to help keep
Crash Course free for everyone forever,
you can join our community on Patreon.
[Music]"
IIJwt3zO4fw,"Okay, so let me tell you about
Christopher Columbus.
So I've been told you can't say any of
that on YouTube. So let's start here
with the Tyeno people. They're one of
the first tribes to encounter Columbus
in what's now the Dominican Republic in
Haiti. Some scholars estimate that there
may have been more than 3 million Tyenos
in Hispanola when Columbus came ashore,
but within a century they were declared
extinct. A whole people gone. except
they're very much still here.
This historical inaccuracy isn't the
only one in the story of the so-called
New World. Far from it. Hi, I'm Jim and
welcome to Crash Course Native American
history.
[Music]
Today we're talking about the first
contact between Native Americans and
European colonists. The story that's
often told through this little diddy
about 1492, the ocean blue, and you know
who. First contact is a phrase used to
describe the first meeting between two
communities. And to say that there are a
lot of misconceptions around the first
contact between Native Americans and
Europeans would be like saying Messi is
good at soccer. Major understatement.
You can feel the Ninia, the PA, and the
Santa Maria with all that
misinformation. So, let's start off with
a quick fact check. The only thing
Columbus set out to discover was a
better way to get from Spain to Asia.
The trade route known as the Silk Road
was something of a shle between Europe
and Central Asia, and the Ottoman Empire
shut it down in 1453, prompting the
so-called Age of Discovery. So, Columbus
proposed a mathematically incorrect plan
to sail west across the Atlantic. He got
funding from the king and queen of
Spain, Ferdinand and Isabella, who were
pretty psyched for all the potential
riches and the opportunity to spread
Catholicism around the globe. Columbus
and his crew made landfall in 1492 in
what's now the Bahamas and he claimed
for Spain what he believed to be India.
Big colonizer energy. The Bahamas were
home to the Lucayans, a branch of the
Arawak tribe. Columbus immediately took
six Lucayans as slaves or servants in
his words. So yeah, we got some serious
myth busting to do.
[Music]
In the Americas, the idea of first
contact is described like this. Columbus
shows up in the Bahamas and boom,
Europeans have met Native Americans. But
because neither Europeans nor Native
Americans are just one thing, Columbus
was only the first contact between the
Spanish Empire and the Lucayans. There
were countless initial means between
Europeans and Native Americans both
before and after Columbus got lost.
Like there's evidence that more than 500
years before Columbus, the Scandinavian
Vikings came to Greenland where they
encountered the native Tuli people. And
there were first contacts in Alaska and
Hawaii, too, which we'll get into at a
later episode. First contacts between
different Europeans and native nations
continued occurring all the way through
the 1800s. The first encounter the
sailors had with non-natives wasn't
until 1805 when the Louiswis and Clark
expedition wandered into their territory
in Montana looking for horses and
directions. So first contact is kind of
a misnomer as is the idea of discovery.
I mean Columbus has been celebrated for
centuries for discovering a continent
that millions of people already lived
on.
Fresh untamed wilderness.
I shall call it Hey. Hey buddy. We're
kind of filming here. This is our
studio.
>> Studopous.
A name that just came to me in a divine
vision with no outside influence.
>> Again, already here. But you know what?
Never mind. I'm going to get a holiday
named after me for this one. Someone
tell the Pope.
So, if you've ever wondered how
colonizers got away with just showing up
to someone's home or studio and claiming
it as their own, you can thank the
popes. In 1493, Pope Alexander V 6th
made a decree, also known as the Papal
Bull, that any land not inhabited by
Christians could be discovered and
claimed by Christian rulers. Interetra
was the third in a trilogy of paple
bulls that made up what's called the
doctrine of discovery. And this became
the legal basis for Europeans claims
over indigenous lands and later
Americans justification for westward
expansion. You know the old saying,
paper bulls gives you wings. The point
is this defense held up in court as
recently as
2005 and its impacts had been felt by
indigenous peoples all over the world
for centuries. We'll circle back to
sketchy land grabs in a bit. But
regardless of first, second, and
thousandth contact, one thing's for
sure, European arrival was catastrophic
for Native American populations. While
exact numbers are hard to pin down
because of fragmented historical
evidence, the overall population may
have been decreased by as much as 90%.
And you can bet that there's a detail or
two missing from that chapter of the
history books.
A lot of that population decline I
mentioned gets blamed not on the
colonizers themselves, but on the
diseases that they carried, which led to
major outbreaks. Historians sometimes
call these outbreaks virgin soil
epidemics because diseases like measles
and smallox were new to Native American
populations. So, their immune systems
hadn't built up any resistance to them,
which made the diseases incredibly
deadly and widespread. And while it is
true that epidemics killed many people,
the whole truth isn't quite so
straightforward. Research shows that it
was disease in combination with all the
other fallout from European
colonization, including but not limited
to war, enslavement, and starvation that
made Native Americans especially
vulnerable. And this nuance is important
because if you focus primarily on
disease, it obscures the truth that
colonizers purposely killed millions of
people and harmed many more.
Now, just a warning. I'm about to get
into an example of genocide. This is
some heavy history, and it's important
to take care. In 1848, the discovery of
gold in California incited a rush of
settlers who engaged in what was
literally called Indian hunting. This
practice was not only legal, but
encouraged. In 1851, Governor Peter
Bernett declared that a war of
extermination will continue to be waged
between the races until the Indian race
becomes extinct. State and federal
governments spent nearly $2 million on
what's referred to today as the
California genocide. In all, the native
population of California dropped from
around $350,000
at first contact to about 18,000 by
1880. And that was very much
intentional. This is hard history to
tell just right because when we focus on
all the horrible things that have
happened to native peoples, it can
create the impression that we were
passive throughout it, that we were and
are victims, when in reality, we're so
much more than that. For starters, not
all interactions between Native
Americans and Europeans were the same.
Cooperation and exchange did happen. And
I'm not just talking about the Wampaog
teaching the pilgrims how to grow corn.
In many cases, Native American tribes
dealt with Europeans using diplomacy or
trade and created strategic alliances
that gave them advantages over other
native nations. For instance, tribes
such as the Aangquins, the Inu, and the
Windot allied with the French, and many
traded furs for valuable European
imports such as guns. But unlike French
fur traders, British colonists were more
likely to demand control over native
people and their land, which led to some
major conflicts.
Sometimes tribes join forces to fight
off an invasion, like in the case of
Pontiac's rebellion, named for the
Ottawa chief who coordinated a bunch of
tribes across the Ohio River Valley and
the Great Lakes region to try to oust
the British. In response to the
uprising, King George III signed a
proclamation of 1763, drawing a boundary
around indigenous lands that European
settlers couldn't cross. And then you've
got one of the most famous military
victories for Native Americans, the
Battle of the Little Bigghorn.
In 1875, the US government was trying to
force the Lakota Sue onto reservations,
and they pushed even harder when gold
was discovered in the South Dakota Black
Hills, which are sacred to them. When
the tribe refused to sell, the US tossed
a former treaty to the wind and sent in
last Kuster and his calvary, who were
met with a prompt defeat.
The story doesn't end there. The US
retaliated by illegally seizing the
Black Hills 2 years later, and now they
look like this.
But the story doesn't end there, either.
In 1980, the Supreme Court ruled that
the land had been wrongfully taken and
awarded the Sue Nation $12 million as
compensation. $12 million. Those were
some fat stacks. But the Lakota Sue
pulled a baller move when faced with
that offer. They said, ""No, we are
nothing without the Black Hills."" Chi
chang historian Nick Estus said in a
documentary on the subject. That's why
the Black Hills are not for sale because
we are not for sale.
Mic drop. Native resistance continues
today. And sometimes that looks like
riding the historical record.
Remember when I said that the Tyino
population was devastated by Spanish
colonization? They were labeled extinct
soon after a 1565 census listed only 200
naves living on Hispanola. But that
doesn't tell the whole story. In 1533,
the Spanish had freed enslaved native
people, but not enslaved Africans. So to
keep their enslaved workers, many
Spanish colonizers reclassified Tyenos
as Africans. Nice loophole, guys. And in
the early 1800s, the Spanish changed
their census categories so that Puerto
Ricans could identify themselves only as
white or non-white. Tinyos themselves
didn't disappear. Their label did. A
label that was created by colonizers.
[Music]
Nevertheless, Tino culture persisted for
centuries in passed down stories and
traditions like baking cassav, a type of
yuca bread. And after decades of
research, a major shakeup happened in
the early 2000s when a study out of the
University of Puerto Rico revealed that
23 to 30% of Dominicans, 33% of Cubans,
and 61% of Puerto Ricans had indigenous
genes. The research confirmed what Tino
people already knew, that they're still
here, despite the efforts of what they
call a paper genocide, meaning a sort of
erasure from history through what might
otherwise seem like boring old
paperwork. Fortunately, by the 2010
census, Puerto Ricans could label
themselves as American Indian or Alaskan
Native, and awareness for Tino ancestry
continues to grow. In 2016, a group of
researchers from across Europe, the US,
and Mexico was able to sequence and
analyze ancient Tino DNA from a
thousand-year-old tooth found on the
island of Alra in the Bahamas. It showed
even stronger evidence of a continued
indigenous presence in the Caribbean,
especially in Puerto Rico, which is so
cool. It makes me think about how
important the stories we tell are to
understanding ourselves and our history.
All this goes to show just how wrong the
idea of a single first contact between
Europeans and Native Americans really
is. Instead, there were hundreds of
contacts across hundreds of years that
reshaped the land we now call the US and
the people on it.
But that reshaping isn't over. Next time
we'll talk about treaties and how Native
have been using them to get their land
back. And I will see you then. Thanks
for watching this episode of Crash
Course Native American History, which
was filmed at our studio in
Indianapolis, Indiana, and was made with
the help of all these nice people. If
you want to help keep Crash Course free
for everyone forever, then you can join
our community on Patreon.
[Music]"
