video_id,transcript
hX6lzkQBmhc,"Where is Latin America? Well, just like
the question, who's the most iconic
Spice Girl? The answer depends on who
you ask. Some people say Latin America
is anywhere south of the US. Others say
it's anywhere south of the US where
romance languages are commonly spoken.
So, we're talking about anywhere from 20
to 52 countries and territories where
hundreds of languages are spoken across
millions of square miles. As I scrolled
through these debates in a few scholarly
toms and read it, I couldn't help but
wonder why lump so many distinct
countries into one identity. What makes
a Latin American Latin American? Hi, I'm
Kurly Velasquez and this is Crash Course
Latin American literature. [music]
Do we have to agree on what Latin
America is before talking about Latin
American literature?
How much time do you have? It turns out
the Latin American label is surprisingly
new. Some historians say the term began
with the French in the 1830s. In an
attempt to seize power over Mexico,
Napoleon the third, no, not not that
Napoleon,
the one with the bigote. Yes. Yes.
wanted to emphasize that both France and
Mexico shared Latin roots in their
languages, hence Latin America. This was
an example of imperialism where one
country takes power over another and
it's a critical part of Latin American
history. But so is resistance to
imperialism. Others credit the name
Latin America to Chilean politician
Francisco Vilvao who called for dozens
of countries to unite under this shared
identity and the fight against global
imperial powers. Today there's
disagreement about why the term has
stuck around too. Is Latin America still
in use because outsiders flatten other
cultures into falsely uniform
identities? Or because people from the
region feel a shared sense of community
despite national differences? In this
series, we'll use Latin America to mean
countries with the shared history of
colonization by Spain and Portugal,
followed by independence. But to get a
bigger picture, we'll also explore
indigenous literature and Latin American
authors in the US who write in English.
One thing you'll learn about me is I
don't do anything small. And all these
questions about what unites and divides
a region, about where its boundaries
fall, about who we are in relationship
to each other, they're not simply
hurdles we have to clear. They're some
of the central questions at the heart of
so much of Latin American literature.
Now, because Latin Americans are
diverse, it's challenging to choose one
label to describe us. Like in the US,
you may hear the terms Latino or Latina
to refer to immigrants from Latin
America and their descendants or
genderneutral alternatives like Latinex
or Latina. You guys, it is one letter
change. We will all survive. I promise.
Meanwhile, the term Hispanic refers to
people of Spanish-sp speakaking descent
or origin. So, someone from Spain would
be Hispanic but not Latino. And a
Portuguese-speaking Brazilian might
consider themselves Latino but not
Hispanic. And there are a lot of other
community specific terms out there like
cho for people of Mexican descent living
in the US or Afro Latino for those in
Latin America with African ancestry or
even New Rican for Puerto Ricans living
in New York. So yeah, Latin America
includes lots of different communities
across lots of different countries and
languages, which means in literature we
find lots of different answers to the
question, who are we? Some Latin
American authors like Mexican Canadian
writer Sylvia Moreno Garcia write mostly
in English. Others write both in Spanish
and English. and some flip between
languages even within the same text like
Los Rios Profundos deep rivers by Jose
Maria Argedas uses both Spanish and the
indigenous language Ketwa. Sometimes
you'll find Spanglish a mixture of
Spanish and English like in Sandra
Cisneros's The House on Mango Street.
You'll also find Portuno, a blend of
Portuguese and Spanish like in Fabian
Seo's novel No,
Nights in the North. And language plays
a big role in the international
availability of Latin American
literature too. Well, language, power,
and you know, capitalism. Like, US
publishers have been more interested in
books from Argentina and Mexico for at
least the last decade. So, these are the
books that tend to get translated into
English, and that influences what can
make its way into English language
classes and crash courses. In this
series, we'll span diverse genres and
take a broad view of what literature
means or literature if you're Oprah.
We'll cover the usual suspects, poetry,
novels, and short stories, but also dive
into historical accounts, political
essays, and other texts. Do my ex's text
messages count too or not so much? Oh,
you're saying no. Okay. often will
encounter authors with ties to multiple
countries like Gladis Leeto was born in
Ukraine but spent much of her life in
Brazil and the Cuban writer Jose Marti
wrote for an Argentine newspaper while
in exile in New York. So, it's no
surprise that Latin American literature
often wrestles with big questions about
identity, like what's our relationship
to Europe and the rest of the world for
that matter after being colonized and
gaining independence? And what's our
relationship to our indigenous ancestors
and our African ancestors, too? Given
the blend of indigenous, African, and
European influences, who even are we?
Anyone? Anyone?
Okay, how about we hash this out with
Mexican writer Octavio Bas. Here are the
curly notes on P's 1950 essay loss de la
Maline the sons of Maline.
Maline wasn't your average senora. She
was a multilingual indigenous woman who
after being enslaved and handed over to
the Spanish as a teenager interpreted
for Ednan Cortez during [music] his
conquest of Dino Titlan in 1521. She and
Cortez also had a son who's seen as one
of the first mystisos, meaning people of
mixed indigenous [music] and Spanish
ancestry, which describes most of
Mexico's population today. Bas writes
that Maline is often remembered as a
traitor who gave herself voluntarily to
the concistador and that the Mexican
people have not forgiven La Maline for
her betrayal. He points out that the
word Malineista became a popular insult
to quote denounce all those who have
been corrupted by foreign influences. Am
I tripping or is Cortez the real villain
here? Bas argues that the reason
Mexicans condemn Malinee is [music] to
try to distance themselves from a
painful part of their past and
transcended. The Mexican does not want
to be either an Indian or a Spaniard,
nor does he want to be descended from
them. He denies them and he does not
affirm himself as a mixture but rather
[music] as an abstraction. His
beginnings are in his own self. I'm
going to need some gapito to process
this one.
Much better. When your national identity
is a mix of cultures and has been shaped
by violent colonization, how do you
begin to answer a question like who are
we? How far back should we go for
answers? and how close to home should we
stay? Another Mexican writer, Carlos
Fuentes, explores those questions in his
1975 novel, Deer Nostra. Rather than
analyze a single historical figure like
Maline, Fuentes prowls for answers
across history, zooming between ancient
Rome, pre-colonial Mexico, 16th century
Spain, and 1999 Paris. But Fuentes
doesn't stop there. He links Spain's
colonization of the Americas to a much
bigger story. A New York Times review
described Terran Nostra as a panoramic
espano American creation myth and the
scholar Lucille Kerr says that it
explores Mexican identity in terms of
universal myth and history. In the world
of Theronostra, the mystery of Mexican
identity is the same mystery of
civilization on which civilization
itself is founded. Meaning like we're
all products of violent histories of
borders that shifted over time. All of
civilization is a story of different
peoples clashing and melding and
becoming something new. In this way, the
Latin American story or stories really
shed light on all of our stories. Much
of the Anostra focuses on a
fictionalized account of the real life
Spanish king Felipe II, who was a true
Nepo baby. He inherited his entire
kingdom from his dad. Must be nice. All
I got from my dad was a used Honda.
Filipe obsessively constructed a massive
palace/moselum
called the escoreal and Fuentes portrays
it in a real the emperor has no clothes
kind of way. Even though Spain colonized
and held power in the Americas for
centuries, Filipe's single-minded focus
on what amounts to an extremely
elaborate coffin reflects the emptiness
of the whole colonial project as based
on death on Nada. And Fuentes wasn't the
only writer to explore Latin American
identity by thinking globally. Before
him in Argentina, Jorge Luis Boures
wrestled with these issues in his work.
He was of Spanish, Portuguese, and
English descent, educated in
Switzerland, and traveled off into
Europe. His whole life and work was at
the crossroads of these identity
intersections. And in his 1951 essay, El
escentino
tradition, the Argentine writer and
tradition, Boures encourages others to
work at these crossroads, too. He
resists the idea that to be an Argentine
writer means only dabbling in your own
backyard. We must believe that the
universe is our birthright and try out
every subject. Besus is capturing a
tension between the local and the global
that can be found in a lot of Latin
American literature in communities
living with the legacy of colonization.
You can't start asking a question like
who are we without searching the world
for answers. So what do you do with
that? The Brazilian writer Oswald
Deandra suggests cannibalism,
cultural cannibalism that is. He does it
himself in his 1928 essay manifesto
anthropoago.
cannibalist manifesto with this line.
Dupy or not dupee? That is the question.
Sound familiar? He's reappropriating
Shakespeare's famous line from Hamlet
using the similar sounding name of an
indigenous people in Brazil. Like why
not devour and Brazilify one of the most
famous lines in English literature?
Andraj calls for Brazilians to do the
same. Take in the influences, blend them
up, and pour them out as something
totally new. Oh, thank you. It's my
postc colonial protein smoothie.
I think it needs some work. In a vastly
diverse region, you're not going to find
one single answer to the question, who
are we? Latin American literature is
produced across many different
communities in many different languages
from a blend of influences. And when
Latin American writers explore identity,
they're often navigating the tension
between influences from their own
neighborhood and the other side of the
world. To which I say, no loss. Why not
both? Next time we'll talk about how
stories, history, and politics collide.
See you then. Thanks for watching this
episode of Crash Course Latin American
Literature, which was filmed at the
Gardlos Hernandez studio in Indianapolis
and was made with the help of all these
nice people. If you want to help keep
Crash Course free for everyone [music]
forever, you can join our community on
Patreon. Oh, and if you're interested in
learning about some of the topics
covered in this episode, we pulled
together a playlist you can dig into."
iBRwcnTUthc,"Yes.
Well, wait.
Hi, I'm Curly Velasquez and this is
Crash Course Latin American literature.
In 13 episodes, we'll explore the
trends, tropes, and movements of a super
diverse region. Considering everything
from pre-colonial indigenous texts to
contemporary novels, and spoiler alert,
it isn't all magical realism. Now,
before you go, eh, Curly, I'm not really
a book girly. Stop right there. Reading
isn't just a school thing. My book club
is about the cheese, the gossip, love,
heartbreak, and Labacina next door who
always takes up two parking spaces. What
I'm saying is books can be juicy, and
there's something for everybody in Latin
American literature. Romance, action,
family drama, mysteries, politics, and
my favorite, ghosts. Literature is one
of the most direct portals we've got to
other people's lives. It helps us better
understand each other, the past, and
even the time we live in now. And we can
look at literature through different
lenses. What does this novel tell us
about identity, family, memory, even
ourselves? And listen, we're not here to
serve up everything you need to write a
five-page essay. Think of this series
more like a shakuerie board. A bite of
this, a nibble of that. In every
episode, we'll snack on a few texts and
chew on the historical, cultural, and
political forces that shape them. Oh,
and one more thing. It's okay if you
didn't do the reading. No, for real. We
got you. So, let's meet back here for
Curly's Book Club. I mean, uh, Crash
Course Latin American Literature. Adios,
Missas. Thanks for watching this episode
of Crash Course Latin American
Literature, which was filmed at the
Carlos Ednund Studio in Indianapolis and
was made with the help of all these nice
people. If you want to help keep Crash
Course free for everyone forever, you
can join our community on Patreon."
xtwJfk94CP8,"In 2024, Native Nations in South Dakota
were beefing hard with the state's
governor, Christy No. She had removed
Native American history from state
teaching standards, called Native kids
hopeless, and claimed tribal leaders
were working with drug cartels. Enough
was enough. It was time to take action.
All nine native nations in the state
decided to kick her out, banning the
governor from setting foot on their
tribal land. But wait, wait, wait. Can
tribal governments actually do that? Hi,
I'm Jay Jim and welcome to Crash Course
Native American History.
[Music]
Tribal governments are the governing
bodies of federally recognized tribes,
each separate and distinct in its own
right. And yeah, they can keep people
from entering their lands, even if they
happen to be a state governor. This is
just one example of how tribal
governments can sometimes conflict with
federal and state ones. But bans aren't
the only way they exercise their power.
Far from it. Today, we're going to talk
about how tribal governments operate and
the delicate tight ropes they walk. But
before we dive into the nitty-gritty
politics of it all, let's start with
some basics. Native nations have always
had an inherent right to self-govern
known as sovereignty, which you can
learn a lot more about in episode two.
And because of that sovereignty, tribal
governments have a totally unique
relationship to the US governments where
they're subject to certain federal laws,
yet make their own laws on their own
land. This creates a push and pull that
pops up all the time. like it came up
around plans to build a pipeline near
the Standing Rock Stew reservation in
2016 and it comes up fairly often around
casinos built on Indian territory. The
way these issues are negotiated shows us
how the expression of sovereignty by
tribal governments changes over time.
We'll get more into each of these
examples in a moment, but first there's
another even broader kind of conflict, a
conflict of values about how government
should even work in the first place.
Let's turn back the clock to 1934 when
the New Deal reigned supreme and a stamp
only cost three cents. This was just a
few years after the US government had
formally acknowledged the awful
situation they'd put native nations in.
The average tribal member lived in
poverty. Generations of native kids had
been ripped from their families and sent
to abusive boarding schools. And tribes
had lost 90 million acres of land in
just 50 years as a direct result of
federal policies. Yikes. So, in an
attempt to fix all that damage, Congress
passed the Indian Reorganization Act,
aka the IRA. The goal was to reaffirm
the government's support of native
sovereignty. Love that for us. But
there's a catch. Policy makers didn't
think traditional native governments
were fit for the demands of modern life.
Traditionally, some tribal governments
ruled by consensus, where leaders would
hold community discussions about
everyone's concerns and move towards a
solution that blended all of their
perspectives. Everybody heard each other
out and cooperated to find a compromise.
This was and is a hugely important value
underlying how many tribal governments
work. But the US wanted tribal
governments to reflect their own and
withheld IRA funding until tribes gave
themselves a makeover. Specifically, the
federal government wanted them to move
to a system of majority rule where the
group chooses the option that gets the
most votes regardless of other people's
concerns. A lot of tribes weren't
thrilled about giving up their consensus
governments. In fact, 77 of them voted
to reject the plan, but 181 native
nations did reorganize under the IRA.
And today, there are two main ways those
tribal governments are set up. with a
modern structure or hybrid structure.
Let's start with the modern structure.
Typically, this means having an
organizing document like a constitution
approved by the secretary of the
interior. Usually, but not always,
there's an elected tribal council and
tribal chairperson, which operate as
legislative and executive branches,
respectively. Together, they can
negotiate on the trib's behalf with
federal, state, and local governments.
And many, but not all, have their own
court systems and their own tribal
police. You can see how this reflects
the US government with its three
separate branches creating checks and
balances. Members of the council and the
chairperson are elected democratically
by tribal members, the same as a
congressperson or the president would
be. Meanwhile, tribal laws are enacted
by a majority vote in the council,
similar to Congress, and enforced by
tribal courts, similar to the Supreme
Court. Yep. Yep. looks like a modern
American government. Then there's the
hybrid structure which blends older and
newer forms of tribal governments
together. This mixture can look
different from tribe to tribe. For
example, it can involve making decisions
both through elected officials and
through traditionally selected leaders
or it can involve incorporating
consensus in some parts of governance
but majority rule in others. Take the
prot tribe. They were among the 77 that
initially rejected the IRA. And though
they did eventually establish executive,
legislative, and judicial branches,
they've also held on to traditional
values of consensus through a general
council that includes every adult member
of the tribe. Anybody who's on the
council can independently propose
legislation. And for an initiative to
pass, at least twothirds of the council
needs to be on board with it. So, we've
got a handle on the various ways tribal
governments operate. But what does this
look like in practice? What do tribal
governments actually do? First and
foremost, they govern their own citizens
within their territories. They alone
call the shots on what it takes to be
one of those citizens. They control how
much of their land gets used. They
oversee their own schools, utilities,
roads, and communication networks. And
much like a local or state government,
tribes can issue business licenses and
collect sales tax within their borders.
But at the same time, the federal
government can restrict tribal
government's authority, drastically
affecting native people's lives. We
natives are currently in our
selfdetermination era. Basically, it
means the US government has agreed to
use its authority mostly to defend
tribal sovereignty and help repair the
damage of centuries past. And that means
tribes have more direct involvement in
the public services that are maintained
and delivered in Indian country. But
things aren't perfect. and tribal
agencies often have to navigate a maze
of bureaucracy to get the support that
they need. We're talking miles of red
tape. For example, the National Tribal
Broadband Grant helps link reservations
to high-speed internet, which is a big
deal. It makes it possible for tribal
citizens to do distance learning, work
remotely, have telealth appointments, or
I don't know, watch Crash Course. Just a
thought. But funding sources like this
are spread across seven different
federal agencies. So it could be hard
for tribal governments to even know they
exist, much less identify the funding
they qualify for. And when federal
agencies do make policies that affect
tribes, they're supposed to consult with
tribal governments first. They're
supposed to get input from the tribal
officials before imposing rules and
compensate tribal governments if it'll
be costly to comply with them. That's
what's supposed to happen. But this is
more of an ideal than a description of
how things always go. Take what happened
in 2016 with the construction of the
Dakota Access Pipeline. The corporation
building the pipeline planned for it to
cross beneath Lake Aah close enough to
contaminate the drinking water of the
Standing Rock Sue if an oil leak
happened. The US Army Corps of Engineers
had approved the plan without consulting
the tribe. Understandably, the Standing
Rock Sue weren't happy about this, so
the tribe sued and requested that all
the construction stop at once. The Sue
sued, but construction continued and the
tribe lost in court. The federal
government did ask the company building
the pipeline to pretty please of their
own choosing, leave a buffer of 20 m
around Lake Oah, but the company didn't
listen. The pipeline was built and
continues to operate today, but the
fight isn't over. The Standing Rock Sue
have continued to call for the pipeline
to be removed and the governments and
companies alike are discovering that
tribal governments are a force to be
reckoned with. Just ask Christy Gnome.
And it's not just Standing Rock. Many
other tribal governments are asserting
their sovereignty these days and
resisting efforts to restrict it when
necessary. After all, sovereignty is
like a muscle. The more you exercise it,
the stronger it gets. For example, some
tribes operate casinos or gaming
operations on their land as a way of
raising funds to run their governments,
which is allowed under federal law. The
Indian Gaming Regulatory Act says tribes
can enter into gaming compacts with
states. And if any state law conflicts
with federal law, the federal law is
supposed to apply. Paper beats rock. But
in 2019, the governor of Oklahoma, Kevin
Stitz, tried to block tribes from
renewing their gaming compacts
automatically, which arguably could have
ended those compacts altogether.
Multiple tribes sued, arguing that this
move violated federal law, and the
federal courts agreed because again,
paper beats rock. But asserting tribal
sovereignty is rarely that simple. And
as we saw with the Dakota Access
Pipeline, at times tribes have had to
challenge corporations and the federal
government, fighting a war on multiple
fronts. That's just a small slice of
what makes running a modern tribal
government such a unique challenge. Each
one faces very different problems than
it did five centuries ago. So they've
had to adapt and change while retaining
aspects of their identity as sovereign
independent nations. After all, we're
talking about nations within a larger
nation. things are bound to be complex.
In our next episode, we're going to talk
about the ways that Native nations are
working to preserve their traditional
languages and I will see you then.
Thanks for watching this episode of
Crash Course Native American History,
which was filmed at our studio in
Indianapolis, Indiana, and was made with
the help of all these nice people. If
you want to help keep Crash Course free
for everyone forever, you can join our
community on Patreon.
[Music]"
