video_id,transcript
2XWGxVuOwJQ,"Alaska Natives don't
need to see the headlines
to know climate
change is happening.
They've been reading
the signs for years.
Sea ice gone “rotten” in winter—
too thin to walk on.
Seals, belugas, and salmon
migrating earlier and earlier.
Shorelines getting
swallowed up by the ocean.
All of this within a generation.
Indigenous knowledge like this
is crucial for understanding
the threats of the present.
But can it also point
the way forward?
Hi, I’m Che Jim
and welcome to
Crash Course Native American History.
[THEME MUSIC]
Today’s world is under
massive threat from climate change.
Heat waves, hurricanes,
cold snaps, wildfires —
they’ve all intensified.
Endangering not only
the environment, but also us.
I’m feeling very
chill about this.
It’s a complex problem that’s going to
require a lot of coordinated solutions.
Just ask Crash Course
Climate & Energy.
But one hugely important place
to look for solutions is…
Indigenous communities.
See, no matter where we’ve lived,
Indigenous people have become
experts on our environments.
Some of us learned how
to grow crops in the desert.
Others figured out which animals
went on the move and when.
Still others were able to find
food in every layer of the forest.
All of this is what we call
traditional ecological knowledge,
or T-E-K for short.
It’s information about the world
around us that has been passed down
from generation to generation
since time immemorial.
You can think of T-E-K
as systems of knowledge
formed in relationship
with a specific place.
You might say we’re all TEK-ies.
Look, it’s the last episode,
I’m just going for it.
As I was saying,
this knowledge is particular
to different locations.
For example, how
do you build a boat?
Near the Great Lakes,
you strap sheets of birch bark
around cedar frames,
then waterproof the seams with
a goo of pine sap and animal fat.
But up north, Arctic peoples
built frames out of driftwood
or whalebone wrapped with sealskin—
which is light and elastic enough
to take a hit from an ice floe.
Same question, different answers,
depending on what’s around you.
But while Traditional Ecological Knowledge
is incredibly place-specific,
it’s also about the big picture.
It’s built on the understanding that
everything is connected
by a web of relationships.
Yes. Even you!
Even him.
So, Inuit Elders might talk
about belugas in the ocean
in the same breath as
beavers in the rivers.
They understand that more beavers
means more dams,
means less spawning habitat,
means fewer salmon,
means fewer belugas.
That’s what I mean by big picture;
it’s an ecological view,
all about relationships.
Now, in Episode 8,
we explored how Indigenous people
figured stuff like this out,
hundreds of years before
Western scientists did.
And there are so many ways this
knowledge remains useful today,
and for the future.
Let me tell you a story… 
[snaps fingers]
Native nations in California —
like the Hupa, Yurok,
Karuk, and Mono —
have known for generations
that you can fight fire with fire.
Historically, they burned small,
low-intensity controlled burns
as a way of curating the landscape.
You see, after these burns,
plants that were good for food
and medicine grew back stronger.
And burning kept space
between the older, taller trees,
so flames didn’t rage
through the whole forest.
But when colonizers laid eyes
on these lovingly curated landscapes,
they thought that was
just how the trees grew.
And that the fires were
pointless, backwards.
The state of California outlawed
intentional burning in 1850,
while forcing many tribes off their lands.
Meanwhile, the forests were
logged and replanted —
this time, twice as densely.
Fast-forward to today.
Thanks to climate change,
wildfires are a serious threat.
These denser, warmer, drier forests
are like a box of matchsticks.
And Western scientists
are starting to understand
what tribes have
been saying all along:
good fire can prevent bad fire.
Thankfully, the government
is coming around, too.
In 2022, the State of California affirmed
tribes’ rights to practice cultural burning.
Today, some tribes —
and their good fire —
are being welcomed back
on the land that hasn’t been touched
by cultural burning
in over 150 years.
And that is the
story of good fire.
So there’s some
good stuff happening!
But there’s much
more to be done.
And while climate change
affects everyone,
it doesn’t affect
everyone equally.
Native nations along coasts
and in the far north
are already being
disproportionately impacted,
as their homes are being
hit first and more severely
by climate change’s effects.
Alaska Native communities
are getting a front-row seat
to shorter winters,
earlier springs,
changes in migration,
and thinning ice.
Because of these changes,
it’s getting harder to hunt and fish.
Which is a huge loss.
A recently coined term
— solastalgia—
describes the grief of witnessing
the environment change
in ways you don’t want
and can’t control.
Anybody can feel this.
But as the climate changes,
Alaska Native communities
are especially at risk
of harms to their mental health.
These communities already experience
disproportionately high suicide rates.
And not being able to hunt and fish,
or practice their traditions
impacts their sense of community,
connection, and self-worth.
On top of that, tribal communities
living on coasts are at risk
of losing their homes altogether,
as sea-level rise
washes away low-laying land.
As of 2024, thirty-one Alaska Native
villages are in imminent danger of erosion,
and at least a dozen of those villages
have already chosen to relocate altogether.
In what’s now Washington State,
the Quinault Tribe and
the Shoalwater Bay Indian Tribe
are working to relocate for the same reason.
And that’s just to name a few.
Many tribes are seeking environmental justice,
which involves recognizing
and supporting groups who suffer
disproportionately from environmental damage,
through no fault of their own.
Often as a result of ongoing
legacies of colonialism and racist policy.
And for more on that, check out
episode 1 and 2….
3…4… all the episodes.
But from an Indigenous perspective?
Environmental justice is more than that.
It means taking in,
and taking care of,
the whole picture.
In the words of
Dina Gilio-Whitaker —
a scholar and member
of the Colville Confederated Tribes,
“...justice for Indigenous peoples
is about restoring balance
in relationships that
are out of balance.“
I’ll give you an example.
For generations, the Ojibwe
have had a reciprocal relationship
with wild rice —
which they call manoomin.
In their oral tradition,
a long-ago prophecy
predicted their people
would move west,
to a place “where the
food grows on water.”
The prophecy also predicted
light-skinned newcomers
would either bring brotherhood, death,
or death-disguised-as-brotherhood.
Are those…the only options?
Anyway, the place in the prophecy
was the Great Lakes region.
The “food that grows on
water” was manoomin.
I’ll let you draw your own
conclusions about the rest.
Manoomin is a sacred plant,
but a sensitive one.
It grows best in cool, shallow waters,
after long freezing winters.
Under climate change,
those conditions are
getting harder to come by.
And manoomin has been in decline
in many lakes and rivers for decades,
for lots of reasons.
Dams, pollution, commercial
overharvesting, disease
—it’s all in the mix.
But in some places,
it’s hard to pinpoint
any single cause.
And the Ojibwe understand that
embracing this complexity is the answer.
You can’t talk about manoomin
without thinking in terms of the bigger whole.
In recent years, a partnership
to save manoomin has emerged
between the Lac du Flambeau Band
of Lake Superior Chippewa Indians
and researchers at the University of Minnesota.
Joe Graveen, a scientist with the tribe,
has encouraged non-Native researchers
to embrace an ecological view
of what’s going on with the rice.
To study entire watersheds,
not just specific lakes.
To look at historical documents,
not just last year’s data.
And to build relationships with tribal
members who know this land
and have observed tiny changes
over time that newcomers might not notice.
Tribal members and researchers
haven’t yet figured out
why manoomin is declining
at Lac du Flambeau.
But partnerships like this
might just point to the path forward.
And the Ojibwe are far from the only tribe
using Traditional Ecological Knowledge
to respond to a climate-changed world.
The Confederated Tribes
of the Umatilla Indian Reservation
have created a plan that emphasizes
sharing TEK with other Native nations,
and securing funding to make
housing more energy-efficient.
The Yakama Nation's
Climate Adaptation Plan
includes buying back farm land
to support food security for tribal members,
and restoring some of it to native habitat.
And the Indigenous Seed Keepers Network
is working to restore relationships
between Native nations
and their ancestral crops.
Bringing back seeds that haven’t been grown
in their communities of origin for many years.
And using them to help
feed future generations.
So, where does this leave us
as we reach the end of our journey together?
I guess, somewhere not so different
from the prophecy the Ojibwe ancestors foretold.
Light-skinned newcomers;
brotherhood, death, or
death-disguised-as-brotherhood.
Check, check, check, and…check.
[Che gulps]
But those were just the first
four predictions the prophecy made.
It was also predicted that there would be
struggles, grief, and promises broken.
These guys were good.
And there was another prophecy—
one that foretold the forests
and prairies would disappear,
and the water would be polluted.
And again, the Ojibwe would face
a choice between two paths:
brotherhood or destruction.
The people would only
find the right path, the good one,
if they retraced their steps,
farther back on the trail.
Which is what we’ve
been doing this whole time.
Throughout this series,
we’ve explored just a fraction
of the hundreds of timelines
that make up Native American history.
But we’ve retraced as many
steps as we could,
to try to uncover a bigger picture.
Not just of the past.
But of the present.
And the future, too.
You’ve caught me talking about
five hundred years ago
and last year in the same breath.
And I hope now you understand why.
The past and present are connected,
much more closely than you think.
And there’s knowledge all around us,
just waiting to lead us
further up the trail.
Thanks for watching this episode of
Crash Course Native American History,
which was filmed at our studio in
Indianapolis, Indiana,
and was made with the help
of all these nice people.
If you want to help keep Crash Course
free for everyone, forever,
you can join our community on Patreon."
t6xLo1XYZZs,"It's 1764,
Northwest England, 8:00 in the morning.
Yes, this is still crash course, Futures
of AI. Just stay with me. You put on
your linen shift and petticoat [music]
and start your day at the neighborhood
cottage core textile industry using your
trusty spinning wheel to turn wool into
thread. But today, your spinning wheel
has been replaced by a new giant machine
that can spin eight threads in the time
it takes you to make one. It's called
the spinning jenny, and in one fell
swoop, it's revolutionized [music] the
textile industry and stolen your job.
Wait, rapid technological advances
replacing jobs? Where have I heard that
before? Hi, I'm Kushian Avdar and this
is Crash Course, Futures of AI.
To help us understand exactly how it
could transform our world, some
researchers like to break down AI into
levels. The first level is narrowly
transformative AI. This is the kind of
technology that could lead to
practically irreversible change, but
only in a specific area like the
spinning jenny did for textiles. But
some AI models have the potential to
change all the most important aspects of
our society. We call that second level
transformative AI and it's on par with
inventions like electricity and the
internal combustion engine which you
know transformed our entire world. And
then there's another third level, a
theoretical level that we're building up
to that could make even bigger changes,
ones we can't exactly imagine yet.
radically transformative AI could impact
not just our day-to-day lives, but how
we measure progress, find worth, and
think about our place in the world. Most
people think AI with human level
intelligence, known as artificial
general intelligence, or AGI, would be
radically transformative. It's hard to
predict when AGI will hit the streets or
the cloud. Some people think we're
really close, like a year or two away,
but some others put that number closer
to the year 2030 or even 2050. A small
subset of people think we're centuries
away from AGI, if we achieve it ever.
But even without AGI, we're already in
for some pretty big world restructuring.
One really clear way we're seeing AI
restructure our world already is in the
economy. [music] And to help us
understand exactly how, the industrial
revolution is probably [music] the most
helpful example. See, the industrial
revolution saw a lot of manual labor
become automated, done by fast, accurate
machines like the spinning jenny,
instead of slow, fallible humans like
me. And automation turned out to be
really good for the economy, mainly
because it increased production, [music]
or the amount of stuff that could be
made. That's because normally economies
are limited by the amount of labor or
workers they have available. But the
spinning jenny and other industrial
revolution era technologies helped
industries scoot around that bottleneck
and the era's economy absolutely
exploded. These days, thanks to [music]
AI, machines don't just spin thread.
They can design the clothes it gets made
into, manage inventory at the store that
sells them, run the algorithm that
recommends them to you, and handle
returns and exchanges when you call
customer service. And it doesn't end
with the textile industry. This is
happening across tons of different
markets. And just [music] like all those
centuries ago, that automation could be
really good for our economy. Consider
this. Our gross world product, the final
market value of all the stuff created in
the world's economy in a given year,
usually grows by around two to 5% a
year. But if AI keeps advancing the way
it has been, some people predict that
[music] by 2100, our gross world product
could be growing not by 5% [music]
but by as much as 30% every year. It's
kind of unimaginable. And even though
many economists [music] are skeptical of
this number, it's safe to say that this
could potentially mean really big things
for the economy. But just like back
then, there's a dirty soot blackened
flip [music] side to the automation
coin. What's good for the economy
overall isn't always good for individual
workers. The more jobs that get taken
over by automation, the more human
employees are pushed out of work.
[music] And that could change a lot more
than how long it takes us to spin eight
threads. Narrowly transformative AI is
already changing the workforce. Since
the 2000s, automation has taken over
something like 1.7 million jobs from
customer service to data entry to
manufacturing to writing and editing.
But not here on Crash Course. Don't
worry, humans. And if AGI were to enter
the chat, even more jobs or even entire
professions would be cooked. AGI isn't
here yet, but theoretically it would be
able to do anything human cognition can.
And it might even be able to do that
work better than we can, transforming
not only the economy, but all of human
society in a way we're not ready for
yet. But let's see it wear a top hat as
well as I can. Like AGI could take over
the entire workforce, restricting humans
to narrow positions like AI oversight,
which could be few and far between. And
that's not even mentioning the
environmental impacts of AGI. Even
today's AI uses huge quantities of
energy and water and pumps out huge
quantities of greenhouse gases. Recent
data suggests that the average AI data
center consumes anywhere [music] from
500,000 to several million gallons of
water every day. And if AGI becomes
ubiquitous, that number will probably
skyrocket. All of which is going to
exacerbate the pretty gnarly climate
change we're already seeing, impacting
not just [music] the natural world, but
our human communities, too. If the
radical transformation happens slowly
enough, and [music] governments start
planning for it, like now, we might have
time to make it work, governments could
introduce environmental standards that
require energy usage to be transparent
and [music] push companies towards
greener data centers. They're not
currently where I sit in the US in 2025,
but theoretically they could be.
Governments could adopt structures like
job guarantees that would keep us from
being swapped out by AI. Or they could
take things even further and adopt
universal basic income to make sure
people still have money even if our
labor is replaced by machines. Or
implement dividend schemes where humans
would get small payouts from the profits
AI makes. And that could be really
transformative if AI takes humanity's
place as the beast of burden for our
economy. There's kind of no telling what
we'd get up to. It could totally realign
our values, our social structures, and
and the ways we spend our time. It could
change us from cogs in the capitalist
machine into maybe something else. I
might finally have time to catch them
all.
I'm at one. But if the transition
happens too fast, without the proper
safety nets, AGI could leave the
majority of humanity unemployed, broke,
and well, chat, cooked. Even if robots
don't take over the whole workforce,
these advances in AI could spell
disaster for lots of regular people. One
way this could happen is that the first
people to develop AGI could get really
powerful really fast. That could mean a
single company starts to amass tons and
tons of wealth, making the wealth
inequality of 2025 look like chump
change. And think about it on a
governmental level. What if a single
government could gain huge political,
economic, and military advantages over
all the other ones? The prospect of that
huge advantage could lead to an AI arms
race where countries, corporations, and
maybe even extremist organizations
hustle to build that super powerful AGI
model first. All that stuff could be
pretty bad news for most of humanity. It
could concentrate wealth and influence
in the hands of big companies like
Microsoft or Google, billionaires like
Elon Musk or Mark Zuckerberg, or greedy
governments who don't always have the
people's best interest in mind. It could
be used to support authoritarianism
around the globe. And I'm gonna level
with you. That process is already
starting. Deep fakes are images, videos,
or audio recordings that can make it
look like people are saying or doing
things they didn't really say or do.
They work like lots of other AI does,
where neural networks train on tons and
tons of data until they can start to
generate new data that looks a lot like
it. Only instead of chess games or
novels, these neural networks train on
faces, voices, and body language to
learn how people look, sound, and move.
And they can get pretty good at
imitating people, like say US
presidential candidates. In July of
2024, Musk himself shared a campaign
video from Democratic candidate Kala
Harris where she called herself a deep
state puppet who's hiding her total
incompetence. only Harris never said
that. The video was a deep fake made by
AI models trained on Harris's face and
voice. And it was viewed over 100
million times. Deep fakes are an example
of how AI can be used to influence
voters, spread disinformation, and throw
elections to those willing to play
dirty. And it's not just political
parties who are using AI to influence
politics, but foreign nations, too. Lots
of the deep fake content from the 2024
US election seems to have come from
Russia, a country that might have some
reasons to mess with the US's democracy.
Deep fakes's actual impacts on voters
aren't totally clear yet, but there
[music] is evidence that they've already
influenced voter behavior, not only in
the US, but also in countries like
Slovakia, Indonesia, and India. And
things could only get worse as deep
fakes get more advanced, manipulating
voters with disinformation, generating
doubts around legitimate election
results or convincing people not to vote
at all. Messing with elections like that
is a direct threat to democracy. And if
AI can help people do it, then it could
easily become a tool of
authoritarianism, a pretty powerful one.
And the more AI gets implemented in
things like politics and economics, the
more power it'll have in those systems,
and the more it will be able to enforce
the values of those potentially pretty
evil groups who leverage it. This
hypothetical situation is known as value
lockin and it could leave us stuck with
systems that are inequitable,
anti-democratic, and a threat to human
rights all supported by AI. So that all
sounds scary, but it also kind of sounds
like science fiction. While things like
deep fakes are real and dangerous,
radically transformative AI isn't
actually here yet, and we can't be sure
exactly how things will play out as we
move into our AI future. Things could go
down the radical road where AGI takes
over our jobs and political systems,
robbing us of what it means to be human
or even going rogue and throwing off its
human overlords entirely. And true, AI
development has been increasing
exponentially, blowing benchmarks and
expert predictions out of the water
faster than you can say, ""Alexa, how do
you spell anti-isestablishmentarianism?""
All of which makes that robot takeover
kind of scenario seem more and more
likely by the day. But there are any
number of other things that could happen
too, making our AI future nothing more
than a twinkle in Wall-E's melancholic
robot eye. For instance, governments
could intervene, taking action now to
put a leash on things before they get
too out of hand. Or we could start to
run out of the new relevant highquality
data that AI models need for training
stalling progress. Or maybe AI
development itself could end up slowing
way down. And of course, there's always
the possibility that AI just can't do as
good a job as we think it can. So, the
AI takeover could be fast and shocking,
or it could never happen at all, or it
could turn out the dolphins were behind
everything all along. Anything is
possible. But that doesn't mean we
should get complacent. A long time ago,
the spinning jenny probably sounded like
science fiction, too. And if we look the
other way for too long, we could end up
trudging sadly home in our petty coats,
choking on factory fumes, wondering if
this is the end of life as we know it.
But to really prepare for the
possibilities of our AI future, we have
to answer two really important
questions. How powerful can AI become?
And how quickly can it get there? That's
next episode here on Crash Course
Futures of AI. Crash Course Futures of
AI was produced in partnership with the
Future of Life Institute. This episode
was filmed at our studio in
Indianapolis, Indiana, and was made with
the help of all these nice people. If
you want to help keep Crash Course free
for everyone forever, you can join our
community on Patreon."
