video_id,transcript
YkG_b02j3eo,"There was a time before the spoken word.
It took billions of years of life on
Earth before the fish-like organisms
from which we evolved developed lungs
and a movable tongue, which would prove
to be kind of important for human
speech. So, we learned to speak and
share our ideas. And then, I'm skipping
over here a lot. Don't at me, Hank. We
learned to write. Writing let us put
ideas down and exchange thoughts with
people who weren't in our immediate
vicinity. But for a long time access to
the written word and by extension access
to ideas was very limited. Paper was
expensive. There were political
interests served by limiting who could
read and write. And then came the
printing press which dramatically
increased not only access to knowledge
but also knowledge production. Then
there were newspapers and pamphlets.
Then broadcasting the radio, the TV and
then well let's see what's inside my
friend the secret compartment. Oh would
you look at that? It's a floppy disc.
Only we didn't have any floppy discs, so
we got these floppy disc coasters.
Anyway, then there was the internet,
which I probably don't need to tell you
changed everything about how we
communicate for better and for worse.
But at its very best, the explosion of
information now available on the
internet can be used to make knowledge
more accessible. It can make different
perspectives more accessible. It can
remind us that how things are now is not
how they always were or how they will
always be. And that's what we're trying
to do here at Crash Course. Like in the
last year, we released a series on
religions, exploring how a variety of
religions respond to life's greatest
mysteries. We also made political
theory, a series that zooms way out,
considering how questions first raised
millennia ago, can provide new lenses
for understanding our world now. Then
there's sex ed, which trades shame for
science, sociology, and stories, helping
learners build deeper knowledge about
their bodies, their health, and
themselves. And we're launching an
in-depth series on Native American
history, which begins well before 1492
and extends into the present. So, yeah,
we've been tackling a lot at Crash
Course recently, and no matter the
series, we're committed to a couple
things. It's going to be free and it's
going to be highquality, meaning
accurate and fact-checked, but also
engaging and fun because we're trying to
make the best version of information
post floppy disc on the internet. And
that means welcoming as many people in
as we can. It's an ambitious goal and if
I'm being honest, an expensive one. Each
video is worked on by over 20 people who
are absolutely devoted to quality. From
subject matter experts to writers,
editors, producers, animators, hosts,
the list goes on and on. Ultimately, the
goal of Crash Course is attainable
because of one very important reason,
and that's you. Each year, we produce a
new Crash Course coin, and each coin
that people like you purchase helps us
reach thousands of learners. And
together, our reach continues to grow.
Like recent research from the American
Historical Association shows Crash
Course is used in classrooms in every
state, even more so than a number of
federally funded educational resources.
This year, the coin design is inspired
by access to information, represented in
historical flash points from the
printing press to the advent of the
internet. The design represents our
mission to provide free access to good
information that's easy and fun to
learn. And that's a mission you join
when you purchase a Crash Course Coin.
These beautiful objects are minted in
Arkansas from hand engraved dyes at
Shire Post Mint. And for $100, you can
help us reach 2,000 learners and receive
a beautiful nickel coin. For $500, you
can help us reach 10,000 learners with a
brass one. And for those able to give
$1,000, you can help us reach 20,000
learners and receive a colored titanium
coin, which includes a unique
handstamped number and a signed thank
you card from me and my brother Hank.
The thank you card, by the way, is made
at Noteworthy Printing in Missoula on an
antique letter press, not unlike the
ones used to print the first books in
the 15th century. For the first time
this year, we're offering a limited
edition premium silver coin for $5,000.
In addition to helping us reach a
100,000 learners, you'll adopt a week of
Crash Course, meaning you'll get a
report made just for you about who has
been watching Crash Course and all of
the learning that you made possible.
This is our fifth year of the Crash
Course Coin, and we know some folks are
collectors. So, this year we've added a
collector's plaque where you can display
your coins, whether you're just starting
your collection or you've been getting
all the available coins every year. We
are really honored to do this work. I
think of Crash Course as one of the most
meaningful projects I've ever been a
part of. Your purchase of the coin at
any level allows us to create some of
the best possible educational resources
and make them accessible anytime,
anywhere. We take that responsibility
very seriously, and I can't say enough
how grateful we are for your support.
The 2025 Crash Course Coins are only
available until June 2nd, and we've only
made a limited quantity. So go to
crashcoursecoin.com now or check the
description for a link and help us keep
Crash Course free for everyone forever.
Thank you."
JDixrkU1pp4,"Abortion is a charged topic, 
with strong opinions all around.
And it also involves complex personal 
decisions. But knowing what abortion is  
is a key part of any comprehensive sex ed course.
We won’t get too deep into the politics or 
legal situation surrounding abortion today,  
because those factors are ever-changing.
But we will shine a light on what’s true 
about abortions, and who gets them.
Hi! I’m Shan Boodram and 
this is Crash Course Sex Ed.
[THEME MUSIC]
Head’s up: in today’s episode, we’ll be talking 
about sensitive topics, including miscarriages,  
and why people get abortions. So please keep 
that in mind and take care when watching.
When people talk about abortion, they’re 
usually referring to the medical process  
that ends a pregnancy. That’s called an 
induced abortion, and that’s our focus today.
But there’s also spontaneous abortions. That’s 
the medical term for a miscarriage, when someone’s  
body terminates a pregnancy on its own before the 
20th week. A spontaneous abortion might require  
some of the same medical care used in induced 
abortions, but it depends on the specific case.
A healthcare provider can share 
more information if you need it,  
and you can learn more about why 
miscarriages happen in Episode 9.
We’ll be referring to cisgender 
women a lot in this episode,  
since that’s who most of the research 
and discussion focuses on, but trans  
folk may also need pregnancy and reproductive 
health care services, including abortions.
Now when it comes to induced abortions, 
there are two main ways they can happen.  
The first is by taking medication: 
two kinds of pills over two days,  
that are prescribed by a doctor or 
another licensed healthcare provider.
The first pill stops a pregnancy from developing 
further, and the second pill empties the uterus.  
A medical abortion can happen entirely at 
home or partially at a doctor’s office,  
and it can happen up to 10 or 11 weeks after 
the first day of someone’s last period.
The second kind is an in-clinic abortion, 
when a doctor uses light suction to empty  
the uterus. While the clinic visit may take 
longer, the procedure itself usually lasts 10  
minutes or less, and can happen up to 14 
to 16 weeks after someone’s last period.
There’s also another version of in-clinic 
abortion that can happen up to 24 weeks  
after someone’s last period, which can be a 
little more involved and take a bit longer.
These kinds of abortions are 
significantly less common, though.
In 2021, about ninety-three percent of abortions 
in the U.S. happened in the first thirteen weeks  
of pregnancy, according to the CDC. And less 
than one percent happened after twenty-one weeks.
As far as safety goes, surveys have found 
that when abortions are done under the care  
of a trained medical provider, 
they rarely have complications.
A 2015 study that looked at 
data from more than 50,000  
patients reported that complications 
happen in about two percent of cases.
Like we’ll say many times during this 
episode, though, every pregnancy and  
every person is unique. And if you’d like 
to learn more about any of these procedures,  
you can find more information in the description.
Teen Shan: So, who gets abortions? And why?
Good questions! The short answer 
is… well, there is no short answer.
The Guttmacher Institute, which has been 
tracking this kind of data since the late 1960s,  
estimates that just under a quarter of women in 
the U.S. will have an abortion before they’re 45.  
This number is lower than it was in the past, 
and researchers point to a variety of reasons  
for that, like better contraception 
use and fewer teenagers having sex.
But that estimate of just under a quarter of U.S. 
women represents millions of people. And when you  
ask that big of a group of people why they might 
do anything, you’re gonna get a huge variety of answers.
One of the most widely-referenced 
studies that’s been done about  
abortion is called the Turnaway Study. 
It started collecting data in 2008,  
and surveyed hundreds of women about their 
experiences with abortion, over multiple years.
As part of that study, about 950 women 
shared why they were seeking abortions.  
And forty percent of them said it 
was at least partly for financial  
reasons — either in general, or because 
of specific reasons like unemployment.
Meanwhile, about twenty percent of study 
participants said they were seeking an abortion  
because having a child would interfere with 
their school, work, or other life opportunities.  
And just under thirty percent said it was because 
they had to focus on their other children.
And when it comes to that last point, 
about already having kids — a 2021  
review by the CDC looked at data 
from over half a million abortions,  
and found that sixty percent of 
those patients were already parents.
Someone might also have multiple 
reasons for getting an abortion.
And some of them might have nothing to do with 
finances, family, or their living situation.
Notably, some people — including about 110 women 
from that Turnaway Study — sought abortions for  
medical reasons. They might have a health 
condition that makes pregnancy dangerous  
for them, or problems might come up during the 
pregnancy that affect them, the fetus, or both.
So, there are a lot of variables here 
— and there can be a lot of emotions.  
These are often complicated, heavy 
decisions. And while the data shows  
that most abortions are to end unintended 
pregnancies, that isn’t always the case.
One 2015 study reported that about four 
percent of abortions in the U.S. end a  
pregnancy that was intentional 
but had medical complications.
Teen Shan: I see what you mean about the 
whole “there’s no short answer” thing.
Mhmm, exactly. When it comes to mental health, 
surveys have found that getting an abortion  
affects different people in different ways. 
(You might notice a trend happening here.)  
And this is also something that researchers 
from the Turnaway Study have looked into.
As a part of that larger project, they 
recruited more than 600 women who’d  
received abortions. And with their permission, 
they called them twice a year for five years,  
to ask what emotions they were 
feeling about their decision.
Overall, the team found that no 
matter how the women felt at first,  
nearly everyone’s emotions — both positive and 
negative — were less intense after two years.
And after half a decade, at least 
ninety-seven percent of women  
reported that getting an abortion 
was the right decision for them,  
even if they also said it had been 
a hard decision to make at the time.
As a reminder, though, while data can shed some 
light on how a group of people can feel, and  
can be great for understanding the big picture, 
it also can’t tell you how everyone will feel.
Like, in the Turnaway Study, about half of the 
women said that deciding to have an abortion  
was very or somewhat difficult — and the other 
half reported that it wasn’t a hard decision.
Like we’ve said, every pregnancy, 
and every person, is unique.
Now, when it comes to abortion access — at 
the time we’re filming this, in October 2024,  
the legal situation in the U.S. is complicated.
With a case called Roe v. Wade, the 
Supreme Court ruled in the 1970s  
that the Constitution protected 
a person’s right to an abortion.
But that ruling was overturned in 2022, and now,  
abortion access is largely up to individual 
states. And even when laws aren’t in limbo,
it’s also something activists 
— and your local politicians,  
and your neighbors, and your third cousin 
on Instagram — are often vocal about.
With all these beliefs swirling around, 
you might’ve heard that there's
two camps when it comes to abortion: those 
who argue that abortion should be banned,  
and those who argue that legal 
abortion should be available.
But if you dig into the research, what people 
actually think about abortion is much more  
complex, because it sits right at the crossroads 
of law, philosophy, religion, and science.
Kind of like how cats find a way to sit 
right in the middle of whatever you’re doing.
Since 1995, the Pew Research Center has kept 
track of data on what Americans think about  
abortion. And while those numbers 
have varied a bit over the years,  
the number of Americans who think 
abortion should be legal in all or  
most cases is usually above fifty percent. 
As of 2024, it was sixty-three percent.
Teen Shan: Wait, what does 
“all or some cases” mean?
Way to think critically about data, Teen Shan!
So in 2022, the folks at Pew 
dug a little deeper into this,  
and found there’s a lot going on under 
that “all or most cases” umbrella.
Things like how long a woman has been pregnant,  
whether the pregnancy threatens her health, and 
the circumstances of how she got pregnant — like,  
whether or not the sex was consensual or not
— affected a lot of people’s answers.
Overall, only about nineteen percent 
of participants supported the idea that  
abortion should be legal in all cases, and 
eight percent said it should be illegal in  
all cases. But a whopping seventy-one percent 
answered with some version of “it depends.”
Here’s where that leaves us today. 
Abortion will continue to be debated,  
and attitudes and laws will keep evolving, 
too. We hope this data about what happens  
and why helps you understand this 
big, complex topic a little better.
Next time, we’re talking 
about consent. See you then.
This episode of Crash Course Sex Ed 
was produced in partnership with the  
Kinsey Institute at Indiana University. 
If you are interested in learning more,  
visit their website for resources that explore 
the topics we discussed in the video today.
Thank you for watching this episode, which 
was filmed at our studio in Indianapolis,  
and was made with the help of all of these 
nice people. If you want to help keep Crash  
Course free for everyone, forever, 
you can join our community on Patreon."
